,0,1,2,3,4,5,6,7
477,tt6846600,National Theatre Live: Peter Pan,Movie,Sally Cookson,J.M. Barrie,2h 10min,7.9,"When leader of the Lost Boys, Peter Pan, loses his shadow during a visit to London, headstrong Wendy helps him re-attach it; in return she is invited to Neverland."
478,tt7933596,Mobile Suit Gundam Thunderbolt: Bandit Flower,Movie,Kô Matsuo,Kô Matsuo Yasuo Ohtagaki Yoshiyuki Tomino,1h 30min,6.6,"Eight months after the One Year War, the Earth Federation attempts to secure and destroy the Psycho Zaku from the hands of a cult called South Seas Alliance."
479,tt0368305,"Subdivision, Colorado",Movie,Neil Widener,Neil Widener,1h 10min,6.9,"Genesee is tired of spending everyday fishing in her neighborhood with her three best friends--Patton, Chris, and Stock Exchange. She wants an adventure! Her wish is granted when the crew stumbles upon an Indian arrowhead that magically levitates, pointing to an unseen target. The gang decides to follow the mysterious 'compass,' unaware that it carries an ancient curs... Leer todo"
480,tt2058108,The Walpurgisnacht,Movie,Stephen Smith,Stephen Smith,1h 29min,No especificado,"In the early 20th century, the Chambers family is plagued by an unknown evil. The threat to the family comes from a mysterious woman in black and an Ancient magical tome, The Walpurgisnacht. Elijah Chambers, the patriarch of the family, is driven to use The Walpurgisnacht in an effort to protect his family from a danger which he does not understand. Is the threat to t... Leer todo"
481,tt0461770,Enchanted,Movie,Kevin Lima,Bill Kelly,1h 47min,7.1,"Una joven doncella de una tierra llamada Andalasia, que está preparada para casarse, es enviada a la ciudad de Nueva York por una reina malvada, donde se enamora de un abogado."
482,tt3559258,Rio Cigano,Movie,Julia Zakia,Julia Zakia,1h 21min,6.3,"As a child, the gypsy Kaia is abruptly separated from her younger cousin, Reka. Reka grows up in a mansion as the servant of a countess, with only vague memories of her gypsy origins. The countess is obsessed with not getting old and believes blood to be the source of youth. Kaia, after becoming an adult, decides to leave her gypsy community, and sets out alone on a j... Leer todo"
483,tt7383416,Larry: Episode 1: Larry the Little Freakin' Knight,Movie,Josiah Brooks,Josiah Brooks Adam Ipsen,No especificado,No especificado,It is time for the people of Karryon to meet their chosen one. Too bad he's tiny.
484,tt9193612,"Kimi to, nami ni noretara",Movie,Masaaki Yuasa,Reiko Yoshida,1h 35min,6.8,Una surfista y un bombero se conocen y se enamoran. Ganadora del premio a la mejor animación en el Festival de Sitges de 2019.
485,tt6622130,Mei Kongque,Movie,Jian Gao Huijing Guan Jingjian Hou,No especificado,1h 28min,No especificado,"Qunfang House is a famous dance hall of the city of Cui, an unprecedented event. In particular, the pillars of Qi Ling, a peacock dance Yan Qunfang."
486,tt1796564,My Friend Ganesha 3,Movie,Rajiv S. Ruia,Shabbir Ahmed Rajiv S. Ruia S. Sachindra,No especificado,5.1,"Abused by his relatives, a young boy seeks the help of a truck-driver's wife, and Bhagwan Shri Ganeshji."
487,tt1264071,Los campeones de la lucha libre,Movie,Eddie Mort,Keith J. Rainville,1h 12min,6.1,
488,tt2388771,Mowgli,Movie,Andy Serkis,Callie Kloves Rudyard Kipling,1h 44min,6.5,Un cachorro humano criado por lobos debe enfrentarse a su propia historia y a un amenazador tigre llamado Shere Khan.
489,tt1187064,Triangle,Movie,Christopher Smith,Christopher Smith,1h 39min,6.9,"Un grupo de amigos tiene un accidente de yate y toma refugio en un crucero, pero pronto se dan cuenta de que estaban mejor abandonados a su propia suerte."
490,tt7098266,Nashira Sadachbia,Movie,Myat Noe,Myat Noe,2h 5min,No especificado,No especificado
491,tt2095004,Where the Dead Go to Die,Movie,Jimmy Screamer Clauz,Jimmy Screamer Clauz,1h 35min,3.9,Un grupo de niños con problemas que viven en el mismo bloque son perseguidos por un perro parlante llamado Labby que les lleva en surrealistas viajes infernales entre diferentes dimensiones y períodos de tiempo.
492,tt7390122,Life is Fare,Movie,Sephora Woldu,Sephora Woldu,57min,No especificado,No especificado
493,tt8155182,Leprechaun Returns,Movie,Steven Kostanski,Mark Jones Suzanne Keilly,1h 32min,5.0,"El Leprechaun regresa una vez más, cuando un grupo de chicas lo despiertan de mala gana después de derribar una cabaña para que puedan construir una nueva casa de hermandad."
494,tt11272066,Unknown Dimension: The Story of Paranormal Activity,Movie,Joe Bandelli,Joe Bandelli,1h 35min,7.0,"A deep dive into the making of the films with first time ever interviews with cast and crew, never-before-seen footage from the movies, and a preview of the seventh installment in the franchise, released at the same time as the documentary"
495,tt6571498,Dita in Distress,Movie,Christina Faust,Christina Faust,1h 27min,7.0,No especificado
496,tt12725010,Journey to the East,Movie,Dong Wei,Yuan Zhang Qinyao Li Kar-Ying Law,No especificado,2.3,"Donghai Dragon Girl who is in charge of wind, lost her memory and turned into a fish. She accidentally met Han Miao (Han Xiangzi) , who had a lifelong relationship with her. They were inspired by storytellers and traveled eastward to seek Longmen.Han Miao, an incarnation of Han Xiangzi, one of the Eight Immortals, who helped the daughter of the Dragon King, to ""leap o... Leer todo"
497,tt2785162,Ghost Bride,Movie,David Blyth,David Blyth,1h 23min,3.1,"Young Chinese immigrant Jason Chen is trapped between two women; kiwi girl Skye and Chinese bride May Ling, two cultures; modern New Zealand and traditional China, and two worlds, that of the living and that of the dead."
498,tt0213314,Xing yuan,Movie,Jingle Ma,Chi-Leung Law,1h 36min,7.2,"A man returns from a recent death to find his love, only to have her not recognise him and reject him."
499,tt11950836,Lúa vermella,Movie,Lois Patiño,Lois Patiño,1h 24min,6.0,"El tiempo parece detenido en un pueblo de la costa de Galicia. Todo el mundo está paralizado, pero aún podemos escuchar sus voces: hablan de fantasmas, brujas y monstruos."
500,tt0281707,Cert ví proc,Movie,Roman Vávra,Milos Macourek Roman Vávra Ondrej Sulaj,1h 38min,5.7,"In the land of King Dobromil (Josef Somr) honest labor, decency, honesty and respect among people has become a thing of the past. Instead the country is gradually succumbing to Hell's force and, thus, those who have some remnants of decency prefer to flee. Slightly befuddled herbalist Apollonia (Iva Janzurová) has a dream that the land is rescued by an unknown 'saviou... Leer todo"
501,tt2034692,Habanastation,Movie,Ian Padrón,Felipe Espinet,1h 35min,6.7,"Directed mainly for kids, the film speaks of a Havana that ""reveals two distinct faces, from the everyday life of a couple of kids"", according to the film's official synopsis."
502,tt4012578,O What Wonders Are the Children of Men!,Movie,Zachariah Buck Jesseca Ynez Simmons,No especificado,49min,No especificado,"Something truly fantastic is happening here in Santa Cruz. This film documents the creative imagination bursting forth from students attending UCSC's class Prophecy Against Empire, from a contemporary dance beneath the redwood trees, to a rejuvenation of Logos Bookstore. It is about an intellectual adventure with ancient roots that bloomed in the 1960s with figures li... Leer todo"
503,tt1053844,Ezra Crane,Movie,Matt Davids,Matt Davids,No especificado,No especificado,"Wars raged. Plagues ravaged. Civilization fell. A new dark age took a hold of mankind. Small bands of survivors huddle together living off the remains of the old world. Yet, one man wanders the wild lands alone, shunned and feared. He calls himself Ezra Crane, but who he really is no one knows. One day a young girl interrupts his solitary existence. She calls herself ... Leer todo"
504,tt0327679,Princess Ella,Movie,Tommy O'Haver,Laurie Craig Karen Mc Cullah Kirsten Smith,1h 36min,6.3,"Ella está bajo un hechizo para ser constantemente obediente, un hecho que debe ocultar a su nueva familia adoptiva para proteger al príncipe de la tierra, su amigo, del que se está enamorando."
505,tt4086338,Wei guang shan liang di yi ge qingchen,Movie,Yi-Bai Wang,Kenny Bee Vivi Lee Peggy Tseng,1h 56min,5.8,"This is a story about loneliness and the subconscious, love and ecstasy, the film begins with a female director overdosing for love, and another female writer who decides to run away from her marriage right after getting back from the Full Moon Party in Thailand. When these two chaotic and emotionally disturbed souls meet each other, they start a psychedelic journey i... Leer todo"
506,tt0330954,Swapner Feriwala,Movie,Subrata Sen,Subrata Sen,1h 59min,7.5,
507,tt3718288,Kaibutsu-kun,Movie,Yoi Suzuki,Gozo Yoshimasu,2h 3min,No especificado,No especificado
508,tt0260136,Kuen sun,Movie,Andrew Lau Corey Yuen,Sap Sam Chan,1h 32min,4.3,"A futuristic research compound develops a new police tool called the Power Glove. Supposedly, it gives the wearer incredible powers by letting him tap into the 'unused 80%' of his mental potential. It turns out that the glove also enables the wearer to take over the minds of others, and one unbalanced police volunteer tries to use this to stage a coup. In the end, one... Leer todo"
509,tt0472479,To oneiro tou skylou,Movie,Angelos Frantzis,Angelos Frantzis Spiros Krimbalis,1h 30min,6.2,"During a strange night, a prostitute, an opera singer, a fortune teller, a travel agent, a police chief and an insomniac meet by chance."
510,tt1594970,Liao zhai zhi yi: Nie yu gu gui,Movie,Man-Hong Tong,Gor Yi,1h 37min,5.4,"A handsome, outstanding student and always wins women's hearts, soon married to tycoon's daughter. To prepare for the upcoming exam, he moves in an abandoned house. During his stay, he meets two sexy, beautiful, and troublesome ghosts."
511,tt0313233,Avci,Movie,Erden Kiral,Osman Sahin,1h 28min,5.0,"Osman is a jealous and proud gentleman. Zala, who must have married him at a young age is unhappy. Avci, caught in a storm and had to take refuge in his hut, is an attractive young man who knows how to take advantage of his environment."
512,tt1629737,Panchakshari,Movie,Samudra V.,Thota Prasad Samudra V.Madhu Vipparthi,2h 9min,3.7,"Possessed by Devi Maa, a blessed woman predicts her own death, leaving her shattered family to deal with a look-alike."
513,tt0202586,Shapeshifter,Movie,Philippe Browning,Louis De Loach,1h 35min,2.8,Alex Brown inherits the awesome task of saving his ex-secret agent parents and protecting the planet from evil powers bent on controlling the world's plutonium supply. To do this Alex uses his new found magical shapeshifting power.
514,tt3565160,Towa no Quon 5: Souzetsu no Raifuku,Movie,Umanosuke Iida Takeshi Mori,Toshizo Nemoto Masashi Sogo,48min,6.8,"With their home in jeopardy, some feel it is time to abandon the gardens. A new character steps in, one that Quon knows very well. The end is near, the players are set, and the final battle is about to begin!"
515,tt13528040,Brillebjørn feirer jul,Movie,Kristine Hübert Maiken Marstrander,Kristine Hübert,1h 5min,6.7,Brillebjørn will celebrate Christmas with Johannes and the family. They decorate for Christmas and hope that Santa will come on Christmas Eve.
516,tt22769344,The Haunted Man,Movie,James Swanton,Charles Dickens James Swanton,1h 12min,No especificado,A chemist forges a pact with his ghostly double to lose his sorrowful memories.
517,tt0435687,The League of Gentlemen's Apocalypse,Movie,Steve Bendelack,Jeremy Dyson Mark Gatiss Steve Pemberton,1h 31min,6.1,The notorious fictional town of Royston Vasey is under threat and its inhabitants are forced to leave.
518,tt6895876,Song of Extinction,Movie,Marc de Guerre,No especificado,45min,No especificado,No especificado
519,tt6936384,Dedunu Akase,Movie,Priyantha Colombage,Priyantha Colombage Tharaka Herath Damunumulla,No especificado,6.7,A colorful and musical love triangle which takes a twisted end. Spans for a period of about a decade starting from youthful college times to being grown ups.
520,tt2187147,Die Windpomp,Movie,Etienne Fourie,Etienne Fourie,1h 54min,6.8,"Die Windpomp is an endearing, humorous and quirky fantasy love story that revolves around a summer romance in a retirement village between 20 year old Hendri and Margot, with an unexpected twist."
521,tt5766692,Masters of Romance,Movie,Yolanda Beasley,Yolanda Beasley,1h 47min,No especificado,"Former Oshawa high school sweethearts Krista and Alex cross paths again twenty-five years later and this time it seems fate is on their side, but the more they try to fix what's wrong, the more they realize they may never make it work."
522,tt6336356,Meari to majo no hana,Movie,Hiromasa Yonebayashi,Mary Stewart Riko Sakaguchi Hiromasa Yonebayashi,1h 43min,6.8,"Basada en ""La pequeña escoba de palo"" de Mary Stewart, una extraña flor otorga a una chica poderes mágicos."
523,tt5914996,Nôgêmu nôraifu: Zero,Movie,Atsuko Ishizuka,Yû Kamiya Jukki Hanada,1h 50min,7.3,"Adaption of the sixth Light Novel of series, it follows the story of two new characters, Riku and Schwi, during the events of the Great War prior to the Ten Covenants."
524,tt10322784,El Encanto de la Oscuridad: Parte 2,Movie,Luis Fernando Del Angel,Luis Fernando Del Angel,1h 37min,No especificado,"The murders in the areas surrounding the Aldrich house have started, the illusionist is stronger than ever and trying to find the only missing object to carry out his plan, the darkness is coming."
525,tt0228807,Saimin,Movie,Masayuki Ochiai,Yasushi Fukuda Keisuke Matsuoka Masayuki Ochiai,1h 50min,6.1,"Three apparently unrelated suicides occur on the same day in Tokyo. One involves a young athlete, one a groom at his wedding reception, and the third an elderly man celebrating his wife's birthday. A middle aged detective investigating one of the cases begins to suspect a connection between the three when he discovers that each person mentioned a ""green monkey"" before... Leer todo"
526,tt0099700,Gremlins 2: The New Batch,Movie,Joe Dante Chuck Jones,Charles S. Haas Chris Columbus,1h 46min,6.4,"Los gremlins han vuelto, y esta vez han tomado el control del rascacielos de alta tecnología de un magnate de los medios de comunicación de Nueva York."
527,tt4873338,Newist,Movie,Genco Gulan,Genco Gulan,1h 35min,6.6,"Performers in a metro construction and an ancient cistern, read out loud the text written in New York before 9/11."
528,tt9460580,Hon Papa Da Con Gái,Movie,Ken Ochiai,Michael Thai,1h 53min,6.2,A father and daughter swap bodies and have to learn to live each other's lives.
529,tt1288473,Limbo,Movie,Mitch Temple,Mitch Temple,1h 13min,No especificado,"The extraordinary story of love, magic, murder and mailboxes. A carnival of scenes parade through one exceptional day until reality transforms into a wicked tale."
530,tt10252406,Sphere of Fear 2,Movie,John Mitchell,John Mitchell,2h 14min,No especificado,"It's back from Brazil and more ""terriball"" than before. Dylan Davis is a depressed mess, The Hunter has stolen Faye Le Mort from him, even his dead brother cannot help. Who can help Dylan? The Demon Football of course. Satan wants the Football's help, Dylan needs the Football's help, what can go wrong?"
531,tt8752498,Wonder Woman: Bloodlines,Movie,Justin Copeland Sam Liu,Drew Johnson William Moulton Marston Harry G. Peter,1h 23min,5.9,"Wonder Woman trata de ayudar a Vanessa, una joven con problemas que pertenece a una organización conocida como Villainy Inc., dirigida por el Dr. Cyber."
532,tt13057626,Kamiarizuki no kodomo,Movie,Takana Shirai,Mia Sinclair Jenness Mark Allen Jr.Luci Christian,1h 39min,5.9,"Sigue la vida de una niña de doce años llamada Kanna, quien nació como descendiente de los dioses."
533,tt0462449,Neptune,Movie,Anthony Marchitiello,Dan Abbott Estrella Espinoza Dylan Mc Puke,1h 45min,8.1,"Capodezero Films is pleased to bring you ""Neptune"", the groundbreaking feature by award-winning independent filmmaker Anthony Marchitiello. This post-apocalyptic nature film, set in a nightmarish future not too far off, is chilling look at a species on the verge of extinction...man. After the failure of civilization, the scattered remnants of humanity eke out a meager... Leer todo"
534,tt13400476,Teri Diwali Meri Christmas,Movie,Anurag Jha,Anurag Jha,1h 8min,5.8,"A young girl with seasonal amnesia encounters a man claiming to be God, together both of them try to recover her memories leading to big events."
535,tt0115705,Die blinde Kuh,Movie,Niklaus Schilling,Niklaus Schilling,1h 50min,No especificado,No especificado
536,tt28232117,ANPANMAN: Dororin and the Transformation Carnival,Movie,No especificado,No especificado,1h 2min,No especificado,No especificado
537,tt27040823,Dzhura the King's Son,Movie,Anton Hoida,Yuliia Cherniavska Serhii Uhachevskyi,1h 40min,No especificado,"Rescued and raised by brodnici warriors, son of the King Yurii the Brave suddenly learns one day that he is not just dzhura Ivanko, but a heir to the great dynasty and that he is responsible for leading a decisive battle with the Evil."
538,tt10370042,Ascendant,Movie,Antaine Furlong,Antaine Furlong Kieron Holland,1h 42min,3.5,Una joven despierta atrapada en el elevador de un moderno edificio a merced de unos secuestradores que pretenden apoderarse de su enigmático secreto.
539,tt1688225,In-peul-loo-eon-seu,Movie,J.Q. Lee,Jin-ah Hong,1h,5.7,"Mystery online film ""The Influence"" revolves around promises kept even though time has passed. To keep their values, characters are at a critical juncture to act upon their promises."
540,tt6689414,Grandma Werewolf,Movie,Zachary Will,Zachary Will,1h 30min,5.8,"When a dysfunctional family goes to their recently widowed grandmother's cabin for Thanksgiving, they find out that their grandmother is actually a werewolf."
541,tt6740658,Siêu Nhân X,Movie,Quang Dung Nguyen,Thai Ha Quang Dung Nguyen,1h 32min,4.3,"Super X is about a nice normal guy who, in a freak accident, achieved super strength and speed. He decided to use his super power to help people in need. One time, he got a call that there is a robbery at a diamond event, he came to the rescue, and accidentally made Ky Ky, the daughter of a very wealthy man, become obsess with him. Her obsession is troublesome to him,... Leer todo"
542,tt2501366,Scrawl,Movie,Peter Hearn,Peter Hearn,1h 22min,3.2,A student makes his own comic books where the deaths depicted within begin to come to life. He must join forces with a mysterious woman to rewrite the ending before it's too late.
543,tt3605266,Everything Beautiful Is Far Away,Movie,Pete Ohs Andrea Sisson,Pete Ohs,1h 31min,5.8,"A guy, a girl, and a robothead hike across a desert planet in search of a mythical lake."
544,tt0104604,Ranma ½: Kessen Tôgenkyô! Hanayome o torimodose!!,Movie,Iku Suzuki,Rumiko Takahashi Ryôta Yamaguchi,1h,7.3,"With the Tendos, the Saotomes, Ryoga, Shampoo and Ukyo misinterpreting Tatewake Kuno's invitation to his two loves, Akane and ""The Pig Tailed Girl"", to try his new yacht, a whole new episode of chaos begins in the already unstable lives of the Saotome/Tendo clan. A mysterious shadow kidnaps first Akane's sister Kasumi, then continues on until all the girls disappear. ... Leer todo"
545,tt7780808,La película infinita,Movie,Leandro Listorti,No especificado,54min,5.9,"Based on the remains of never-completed Argentine features from the archives of the film museum in Buenos Aires. The film is, as it were, a parallel film history: an essay like a cinematographic Frankenstein, that blows new life into images that once seemed unsuccessful and pointless."
546,tt8091892,Gekijouban Fate/Stay Night: Heaven's Feel - II. Lost Butterfly,Movie,Tomonori Sudô,Akira Hiyama Kinoko Nasu,1h 57min,8.0,"The story focuses on the Holy Grail War and explores the relationship between Shirou Emiya and Sakura Matou, two teenagers participating in this conflict. The story continues immediately from Fate/stay night: Heaven's Feel I. presage flower, following Shirou as he continues to participate in the Holy Grail War even after being eliminated as a master."
547,tt3059702,Wilsonov,Movie,Tomas Masin,Marek Epstein Michal Hvorecký,1h 55min,5.2,"Comedy inspired by paperback crime novels tells the story of an adventurous search for a mysterious murderer who just after the end of the First World War has begun a rampage in Wilson City, a jerkwater town somewhere in Central Europe. The investigation is being led by an inhomogeneous pair of detectives - a greenhorn and local police cadet named Kvido Eisner (Vojtec... Leer todo"
548,tt13364790,"Ni hao, Li Huan Ying",Movie,Ling Jia,Yu Bu Yupeng Guo Ling Jia,2h 8min,6.9,A woman travels back in time to befriend her own mother in an attempt to make her life better.
549,tt13870714,The Magic of Chocolate,Movie,Tatsuya Kanazawa Rino Mizuho,Mei Hata Ken Nakajima Yui Okada,1h 20min,No especificado,"A shop sells magical chocolates that can grant the eater's wishes. But sometimes the wish costs too much, or isn't always right."
550,tt0371552,Astérix et les Vikings,Movie,Stefan Fjeldmark Jesper Møller,René Goscinny Albert Uderzo Jean-Luc Goossens,1h 18min,6.0,"Los vikingos llegan a la Galia y secuestran al sobrino del jefe. El jefe envía a Astérix y a Obélix al norte para recuperarlo, pero el sobrino se ha enamorado de la hija del jefe vikingo."
551,tt6296024,Devil's Drain,Movie,Dusty Devilly,Clara Abati Claudio Arciero Frederica Avaldi,1h 58min,3.9,Don't try to save yourself!
552,tt0418787,Khalli el demagh sahi,Movie,Mohamed Abou-Seif,Mona El Sawey,No especificado,5.1,"Kamel Shehatah is a simple accountant with simple dreams. He works in a butcher shop for Nimah, mother of the girl he loves and she loves. He tries to forget his worries and problems by resorting to drugs, he and his simple friends like him, until the demon Mutmainn Effendi Sultan, who has been watching Kamel Shehatah for a while, appears. The demon disguises himself ... Leer todo"
553,tt0997035,Bibliothèque Pascal,Movie,Szabolcs Hajdu,Szabolcs Hajdu,1h 45min,7.0,"In order to regain custody of her daughter, whom she left in the care of her fortune-telling aunt, Mona must tell a social worker her story. The tale she spins---and the movie we watch---is a wild, surreal adventure in which people are able to project and enter each other's dreams, and our heroine is sold into slavery and lands in a swank, debauched Liverpool brothel ... Leer todo"
554,tt0479380,Eh kasi bata,Movie,Efren Jarlego,Gretchen Barretto Cesar Montano Romnick Sarmenta,No especificado,No especificado,No especificado
555,tt0310790,El bosque animado,Movie,Ángel de la Cruz Manolo Gómez,Wenceslao Fernández FlórezÁngel de la Cruz,1h 23min,5.0,"Salvo cuando hay gente alrededor, los misteriosos bosques de Cecebre resuenan con la conversación de los diversos animales e incluso los robles, castaños, abedules y sauces llorones."
556,tt0035423,Kate & Leopold,Movie,James Mangold,Steven Rogers James Mangold,1h 58min,6.4,"Un duque inglés de 1876 es arrastrado inadvertidamente a la Nueva York actual, donde se enamora de una valiente ejecutiva de publicidad."
557,tt0163581,Chiu si hung yiu oi,Movie,David Lai Jeffrey Lau,Jeffrey Lau,1h 35min,6.4,"Lau is a policeman who meets his true love in the emergency room of a hospital. He's being treated for severe wounds received in the line of duty, and she's being treated for an attempted suicide."
558,tt2462486,Terror House,Movie,Dianna Renée,Dianna Renée Ren Slyycr,1h 30min,4.5,No especificado
559,tt0104522,Into the West,Movie,Mike Newell,Jim Sheridan David Keating Michael Pearce,1h 37min,7.0,"El abuelo Ward regala un caballo a sus nietos, que lo guardan en su piso de Dublín. El caballo les es robado, y los dos jóvenes se proponen encontrarlo y huir en él."
560,tt13680306,Taalismaan,Movie,Ram Madhvani,Vidhu Vinod Chopra Swanand Kirkire Ram Madhvani,No especificado,No especificado,
561,tt0190641,Pokémon: De Film - Mew Tegen Mewtwo,Movie,Kunihiko Yuyama,Satoshi Tajiri Takeshi Shudô,1h 36min,6.2,"Los científicos crean genéticamente un nuevo Pokémon, Mewtwo, pero los resultados son horribles y desastrosos."
562,tt0093210,La hora 24,Movie,Fernando Durán Rojas,Jorge Barragán,1h 38min,5.5,"A hobo (Julio Alemán) is given the power to know what will happen in the future, but only for 24 hours."
563,tt0129910,The Exotic House of Wax,Movie,Cybil Richards,Cybil Richards Lucas Riley,1h 25min,3.7,"The action heats up when history's most memorable icons come to life for an amorous meltdown in this interactive ""please touch"" museum."
564,tt15393362,Owo Ago,Movie,Allwell Ademola Femi Ogedengbe,Yemisi Ilesanmi,1h 49min,No especificado,No especificado
565,tt0108255,Super Mario Bros.,Movie,Annabel Jankel Rocky Morton,Parker Bennett Terry Runte Ed Solomon,1h 44min,4.1,"Dos fontaneros de Brooklyn, Mario y Luigi, deben viajar a otra dimensión para rescatar a una princesa del malvado dictador rey koopa y evitar que se apodere del mundo."
566,tt2242176,Horsehead,Movie,Romain Basset,Romain Basset Karim Chériguène,1h 29min,4.8,"Desde su infancia, Jessica ha sido perseguida por pesadillas recurrentes. Esta peculiaridad la ha llevado a estudiar la psicofisiología de los sueños y a seguir una terapia con Sean, su mentor y novio."
567,tt12849496,Sha hai zhu long,Movie,Yuhai Wei,Guang Cheng Ge Wu,1h 30min,4.3,"Tianya and his sister are ordered by General Feng Peichuan to embark on a treasure hunt to find the Golden Moon Gem to cure the plague in Heishui Town, but General Feng Peichuan has other motives for finding this treasure."
568,tt7640818,Space Vampire,Movie,Chris Alexander,Ali Chappell Cheryl Singleton,No especificado,4.2,A woman plagued by violent visions walks the world alone as if in a dream. A multi-media meditation on the vampire.
