,0,1,2,3,4,5,6,7
0,tt2951700,Whoops!,Movie,Tony Hipwell Miles Watts,Tony Hipwell Sam Robinson Miles Watts,1h 30min,8.3,Rose Clements - loving mother and wife - is quietly stacking up a body count of accidental murders...
1,tt2014216,Due volte Natale,Movie,Marco Falaguasta,Nathalie Caldonazzo Valeria Fabrizi Marco Falaguasta,No especificado,No especificado,No especificado
2,tt0339412,Mr. 3000,Movie,Charles Stone III,Eric Champnella Keith Mitchell Howard Michael Gould,1h 44min,5.6,"Aging baseball star who goes by the nickname, Mr. 3000, finds out many years after retirement that he didn't quite reach 3,000 hits. Now at age 47 he's back to try and reach that goal."
3,tt19072084,De Familie Claus 3,Movie,Ruben Vandenborre,Ruben Vandenborre,1h 13min,4.3,"La entrega de los regalos se convierte en un desastre y Santa Claus está en problemas. ¿Conseguirán sus nietos, Jules y Noor, unirse para salvar el día?"
4,tt0234921,Tres son peor que una,Movie,Juan Antonio de la Riva,Gabriela Ortigoza,1h 33min,3.5,"Un joven arquitecto con fama de conquistador, tiene una esposa guapa, una amante y una suegra entrometida, sus amigos le aconsejan decidirse por una, pero las tres le dan sentido a su vida."
5,tt2246953,Rentaneko,Movie,Naoko Ogigami,Naoko Ogigami,1h 50min,6.9,A single woman runs a rent-a-cat service to provide companions for lonely people.
6,tt14456978,Struwwelerror,Movie,Lenny Heller,Lenny Heller,45min,No especificado,"The three siblings Luca, Maxine and Theo are left alone at home. Their parents have taken away the family's router on long overdue holiday. Without any internet access, the kids are forced to run free in their deluded state of minds. Events quickly evolve, bloody and evil, for real."
7,tt26684508,ParlaNchíno Ateo: Errorista Comunista 46,Movie,Jorge Luis Villacorta Santamato,Jorge Luis Villacorta Santamato,1h 9min,No especificado,
8,tt0472050,Bart Got a Room,Movie,Brian Hecker,Brian Hecker,1h 20min,5.7,"While Danny's father and mother independently search for love, Danny is on his own desperate quest to find a prom date. Danny's search becomes progressively more pathetic once he and his family learn that Bart, the school's biggest dweeb, not only secured a date for the prom, but got a hotel room as well."
9,tt8731842,Odu Raja Odu,Movie,Jathin Sanker Raj Nishanth Ravindaran,Bharani Gopinath Nishanth Ravindaran,2h 3min,6.9,The hilarious pandemonium happening in a day when a struggling writer tries to get his wife what she wants.
10,tt13799544,Chegoneh Miliarder Shodam,Movie,Ali Abdolali Zadeh,Kazem Afrandnia Mehdi Aminikhah Maryam Amirjallali,No especificado,3.8,"Reza, who is a young man without money and borrowed seventy million tomans to start a business with Mahtab's house, but his partner, Mr. Saadati, has swindled the money, and now Maryam, Reza's wife, and his sister have many complaints about him."
11,tt9471842,Trio,Movie,Ruth Beeckmans Matteo Simoni Bruno Vanden Broecke,Ruth Beeckmans Matteo Simoni Stefaan Van Brabandt,1h 34min,6.5,"Wim, a loner who prefers to stay in and binge watch TV on his birthday, is offered a surprise by his half brother Gert: an hour with Angelique, a sophisticated prostitute."
12,tt13875862,Wild Card,Movie,Jordan Wilson,Jordan Wilson,2h 16min,8.4,No especificado
13,tt0109637,Divorce Law,Movie,Michael Paul Girard,Michael Paul Girard,1h 23min,4.2,How can anyone expect a fair divorce case when all the lawyers are out to do a little hanky-panky on their own?
14,tt12821748,Casa Coco,Movie,Bob Wilbers,Maria Goos Peter Römer Jacqueline Epskamp,1h 28min,5.5,"Pleun from Rotterdam has been running Casa Coco, a guest house for reflection and rest on Bonaire, for years. The Rotterdam people from her own circle of acquaintances like to come over for a wonderful holiday together. This autumn, Pleun's childhood sweetheart Toon comes along with a befriended couple after his wife announces she wants to divorce him, to make him for... Leer todo"
15,tt0112602,Max zéro malgré lui,Movie,Greg Beeman,John Jordan Bobby Farrelly Tommy Swerdlow,1h 30min,5.6,"Framed for murder and on the run from authorities, a sleazy courier poses as a scout leader. But he has no idea what he's in for when he must actually take charge of a group of kids on a hiking trip."
16,tt0446178,Los taxistas del amor,Movie,Julio Aldama Jr.,Julio Aldama Jr.Jorge Aldama Melina Star,1h 27min,No especificado,
17,tt0126438,Minu Leninid,Movie,Hardi Volmer,Toomas Kall Ott Sandrak Hardi Volmer,1h 39min,6.2,Keskküla organizes the so called school of Lenins where the training of Lenin's doubles begins.
18,tt2936938,Zivot je truba,Movie,Antonio Nuic,Antonio Nuic,1h 32min,6.2,"Life Is a Trumpet has a loose jazz musician as the groom, a butcher as his father, and two families of different backgrounds whose members are not as different as one might expect."
19,tt19179936,Der Herr Karl,Movie,Wolfgang Liemberger Klaus Rott,Carl Merz Helmut Qualtinger,No especificado,No especificado,
20,tt3208338,Ban phi poeb,Movie,Phongchayut Sirisukwongsa,Kohtee Aramboy Kom Chauncheun Joi Chwanchuan,No especificado,2.6,
21,tt13955030,Sana baryan yollar,Movie,Myrat Molla,Yagsy Gosunow Myrat Molla Gülnar Tajowa,No especificado,No especificado,No especificado
22,tt2034030,La sacrée,Movie,Dominic Desjardins,Daniel Marchildon,1h 34min,7.0,
23,tt0891485,Gamunui buhwal: Gamunui yeonggwang 3,Movie,Yong-ki Jeong,Yong-ki Jeong Yeong-chan Kim,2h 8min,5.0,"Lead by matriarch widow Hong Duk-ja, the Hong gangster family turns legitimate, but a figure from their past returns to undermine and ruin their popular new business."
24,tt0309419,Caramboles,Movie,Jesús Font,Pau Garsaball,1h 39min,No especificado,No especificado
25,tt0105694,III Chat yat ching,Movie,Sherman Wong,Wing Lok Tang Sherman Wong,1h 34min,5.3,
26,tt0346463,5 Sehat 4 Sempurna,Movie,Richard Buntario,Fathir Muchtar Rena Tabitha Indra Bekti,No especificado,6.1,
27,tt27428529,Church Folks,Movie,No especificado,No especificado,No especificado,No especificado,No especificado
28,tt5344186,Le guerre horrende,Movie,Giulia Brazzale Luca Immesi,Giulia Brazzale Luca Immesi Livio Pacella,No especificado,7.6,"The Captain, a veteran of war, lives in a mysterious forest with a young and odd squire. The sudden arrival of a soldier, who has lost his memory, triggers a series of unmpredictable events."
29,tt11537646,Bagta barýan ýollar,Movie,Annamyrat Gurbanow Wepa Isangulyyew,Döwletgeldi Annamyradow,No especificado,No especificado,No especificado
30,tt1399074,Premi No. 1,Movie,Debu Pattnaik,Rahul Dev Koyel Mallick Anubhav Mohanty,2h 40min,6.2,No especificado
31,tt12126156,"No, porque me enamoro",Movie,Santiago Limón,Maria Hinojos Santiago Limón Pablo Solarz,1h 40min,6.0,"Tras conocerse un día, Gabo Gabeau le pide a Daniela, una de sus fans, que se acueste con su amigo Gerardo, pero la situación se sale de control."
32,tt0282277,Zürich - Transit,Movie,Hilde Bechert,Max Frisch,1h 10min,No especificado,No especificado
33,tt4877410,Wig'd Out,Movie,Kate Chaplin,Kate Chaplin Olivia Rusk Sandy Rusk,1h 25min,9.1,"Hair flies in the life of teenage Olivia who is totally bald due alopecia, when she works in the hair salon that is owned by her ex-beauty queen mom."
34,tt2127305,Kueki ressha,Movie,Nobuhiro Yamashita,Kenta Nishimura Shinji Imaoka,1h 52min,6.8,"Kitamichi is a 19-year-old labor worker. He develops feelings for Yasuko who works in a used used bookstore, but he has never had a girlfriend. He also befriends Kusakabe, but jealousy soon threatens their friendship."
35,tt0143793,Peace by Piece,Movie,Sharon Shamir,Sharon Shamir,1h 10min,No especificado,No especificado
36,tt0339988,Kærlighed ved første hik 3 - Anja efter Viktor,Movie,Charlotte Sachs Bostrup,Ib Kastrup Henrik Frederiksen Dennis Jürgensen,1h 24min,4.3,"Anja throws Viktor out of her apartment after he destroys it partying. She sees him 6 months later. He's grown up, looks good and happy, gotten a job bar-tending as well as a cute, rich girlfriend soon to be fiancee. Anja wants him back."
37,tt27731620,Halfway to Amarillo,Movie,Burt Binder,Burt Binder,1h 22min,9.5,"When Michael Coleman gets stuck while writing his second novel, a Western, the two main characters leap off the page and wreak havoc on his life, forcing him to reevaluate his priorities."
38,tt10569922,Bunty Aur Babli 2,Movie,Varun V. Sharma,Varun V. Sharma Aditya Chopra Jaideep Sahni,2h 18min,4.1,Bunty and Babli are forced out of retirement after a spate of robberies with their trademark sigil start appearing across India.
39,tt0833606,My Bad Dad,Movie,Mack Polhemus,Mack Polhemus,1h 27min,7.0,A family comedy in which a troubled ex-con finds his better self through the love of his young children.
40,tt0366799,Murders and Acquisitions,Movie,Edward Barkin,Edwrd Barkin,1h 22min,No especificado,No especificado
41,tt1666169,Lyubov-Morkov 3,Movie,Sergey Ginzburg,Renat Davletyarov Aleksandr Oleynikov Irina Pivovarova,1h 40min,3.8,A new catastrophe looms over the Golubevs when the in-laws show up unexpectedly and have a hard time getting along -- mostly due to a mutual hatred that dates back to the wedding 15 years earlier.
42,tt0306456,Amnèsia,Movie,Gabriele Salvatores,Andrea Garello Gabriele Salvatores Ramón Salazar,1h 54min,6.1,Several stories unfold simultaneously over three days on the Mediterranean island of Ibiza.
43,tt0367862,Hooch & Daddy-O,Movie,Donna Northcott,Oscar Madrid Donna Northcott Jim Ousley,1h 14min,7.5,"A documentary crew explores the pop culture impact of the '80s cop show ""Hooch & Daddy-O"" and what happens when the cast reunites to film a made-for-TV movie."
44,tt23837232,U-Turn,Movie,Gabriel Afolayan,Gabriel Afolayan Bukola Awoyemi Abibat S. Ayinde,1h 26min,6.0,A driver and his lone passenger embark on a long journey while hiding their true intentions from one another.
45,tt0330069,Blue Collar Comedy Tour: The Movie,Movie,C.B. Harding,Bill Engvall Jeff Foxworthy Larry the Cable Guy,1h 45min,7.1,The comedic stylings of four sort-of famous funnymen are brought to the big screen courtesy of this 2002 documentary.
46,tt0228119,Cas dluhu,Movie,Irena Pavlásková,Karel Roden Vladimír DlouhýJitka Asterová,1h 50min,5.3,"After nine years, director Irena Pavlásková continued the theme she began with her debut Cas sluhu (1989). She returned to the character of the weakling Milan (Karel Roden), a man completely under the thumb of his manipulative wife Dana (Ivana Chýlková). In a fit of spite Milan finds himself in a psychiatric hospital and soon after enters into a complex relationship w... Leer todo"
47,tt0423444,"Un vrai bonheur, le film",Movie,Didier Caron,Didier Caron Sabrina Compeyron Amanda Sthers,1h 23min,4.4,"Odette has planned everything for her daughter's wedding to take place as well as possible: the caterer, the venue, her lifelong friends, nothing has been left to chance for this evening to be unforgettable: It will be"
48,tt0359054,Haz conmigo lo que quieras,Movie,Ramón De España,Ramón De España,1h 38min,5.8,"Néstor, acaba de enviudar, tiene una panadería cerca de Barcelona, dinero y un mal corazón. Su criada le pide que contrate a su hija Maribel, como dependienta. Gracias a las películas eróticas por cable nocturnas, se enamora de ella."
49,tt3145670,Adnan Semp-It 3,Movie,Ismail Bob Hasim,Shaheizy Sam Intan Ladyana Yana Samsudin,1h 23min,4.1,NADIA and WAWA get pregnant! ADNAN is happy because he is finally will become a father. He was prepared to take care of NADIA but turns out he is the one who got morning sickness and such. WAWA and BOBBY lead a moderate life and thus having some financial problems. WAWA gets angry at Bobby because they don't have enough money during her pregnancy time and labour soon.... Leer todo
50,tt0115580,The Associate,Movie,Donald Petrie,Jenaro Prieto Jean-Claude Carrière René Gainville,1h 54min,6.1,A comedy about making it on Wall Street. Prejudices are hard to break and Laurel Ayres quickly learns that in order for people to take her seriously she has to work for an older white man or be one.
51,tt3274708,Kurer iz 'Raya',Movie,Mikhail Khleborodov,Andrey Kivinov,1h 29min,5.4,A funny story about the Moscow policemen travel to a small town.
52,tt1339154,Randomocity,Movie,Tyler Lee Allen,Tyler Lee Allen Ellis Wilder,1h 40min,6.6,This compelling drama tracks the volatile lives of a young couple and their friends as they valiantly struggle to keep their love for one another alive in the aftermath of a terrible tragedy.
53,tt3252030,"The Guesthouse, Tojian",Movie,Jiyoung Kim,Jiyoung Kim,1h 32min,No especificado,No especificado
54,tt1326213,"The Donut, the Balloon and the Lifesaver",Movie,Banks Helfrich,Banks Helfrich,1h 26min,No especificado,An eccentric family gets stuck spending the same Thanksgiving over and over.
55,tt1669831,The Visitor from Planet Omicron,Movie,Mike Donahue,Bill Lynn,1h 36min,5.5,"Un extraterrestre llega a la tierra con un virus botánico, pero una valiente viuda de Arizona lo conquista con su cocina fresca del jardín y luego intenta derrocar al gobierno corrupto que lo impuso."
56,tt21378802,Bumpo Saves the Day,Movie,Baron Xooper,Baron Xooper,No especificado,No especificado,"After making a wish on a shooting star, a young cartoon character must go on a musical journey to fight a mad creator deity in this absurdist mixed media adventure."
57,tt20724032,Free LSD,Movie,Dimitri Coats,Dimitri Coats,1h 40min,8.7,An elderly sex shop owner's attraction to a younger woman leads him to an erectile dysfunction doctor whose treatment reveals an alluring but treacherous alternate reality.
58,tt0466933,Si Prinsipe Abante at ang lihim ng Ibong Adarna,Movie,Tony Cruz,Tony Fajardo Tony Cruz Roger Fuentebella,No especificado,5.2,A vengeful and evil witch puts Prinsipe Abante's (Rene Requiestas) loving father in a deep coma-and the only cure to the king's strange illness is the sweet song of the legendary Ibong Adarna.
59,tt1421040,"Io, loro e Lara",Movie,Carlo Verdone,Francesca Marciano Pasquale Plastino Carlo Verdone,1h 55min,5.8,"When Father Carlo returns home after years spent in Africa in an humanitarian mission, instead of getting the expected peace of mind with his family, he'll face their problems: for instance, his father has married Olga, a much-younger Moldavian woman, and his brother and sister are worried about their inheritance--or what's left of it."
60,tt0152737,Sweet Angel Ass,Movie,Eric Edwards,Eric Edwards,1h 29min,No especificado,No especificado
61,tt0976026,Cheeni Kum,Movie,R. Balki,R. Balki Manoj Tapadia,2h 20min,6.8,An egotistical 64-year-old chef and confirmed bachelor falls for a woman 30 years his junior.
62,tt1296898,Waiting for Forever,Movie,James Keach,Steve Adams,1h 35min,5.9,"Una historia romántica ambientada en Hollywood de un tipo que se conforma con vivir su vida sin trabajo pero con el amor de su vida, una joven actriz."
63,tt3707126,Cup,Movie,Ryan Shields Johnston Jonathan Stimac,Ryan Shields Johnston Jonathan Stimac,No especificado,No especificado,No especificado
64,tt8851198,Funny Girl,Movie,Robert Delamere,Sheridan Smith Darius Campbell Rhianne Alleyn,2h 44min,7.2,"Funny Girl follows Brice, who rose from the Lower East Side of New York to become one of Broadway's biggest stars under producer Florenz Ziegfield. While she was cheered onstage as a great comedian, offstage she faced a doomed relationship with the man she loved."
65,tt0102367,Ma vie est un enfer,Movie,Josiane Balasko,Josiane Balasko Joël Houssin,1h 45min,5.5,A middle-aged single French woman (Balasko) falls in love with an annoying demon (Auteuil).
66,tt3336632,Actores S.A.,Movie,Carlos González Sariñana,Carlos González Sariñana Carolina Rivera,1h 35min,5.2,
67,tt5246742,Achievement Unlocked,Movie,Alvin G. Morris,Robin Madeira Carter Jack Coughlin Adriana Dominguez,55min,No especificado,No especificado
68,tt16426066,Scare Package II: Rad Chad's Revenge,Movie,Alexandra Barreto Anthony Cousins Aaron B. Koontz,Aaron B. Koontz Cameron Burns Alexandra Barreto,1h 38min,4.8,"Cuando el funeral del gurú del terror Rad Chad Buckley se convierte en una elaborada serie de divertidas trampas mortales, los invitados deben unirse y usar las reglas del terror para sobrevivir al sangriento juego."
69,tt14384176,De Familie Claus 2,Movie,Ruben Vandenborre,Ruben Vandenborre Elke de Gezelle,1h 37min,5.5,"Jules Claus has embraced Christmas again and is getting ready for the busiest time of the year together with grandpa Noël. Everything seems to go according to plan, until Jules receives a very special letter with an intriguing question."
70,tt0837786,Bunny Chow: Know Thyself,Movie,John Barker,John Barker David Kibuuka Joey Rasdien,1h 32min,5.2,"Three comedians and a weird guy named Cope embark on a raucous weekend journey to Oppikoppi, South Africa's biggest rock festival. The guys slip out of the city for a few dusty and increasingly absurd days with hopes of mass debauchery, drugs, rampant sex, true love, and conquering the comedy stages, but they get a bit more than they bargained for."
71,tt0464160,Chup Chup Ke,Movie,Priyadarshan Kookie Gulati,Priyadarshan Neeraj Vora Meccartin,2h 44min,6.9,"A debt-ridden young man attempts suicide, but is rescued only to find that his luck is finally turning."
72,tt2071488,Jimmy and Gret Don't Do Sex,Movie,Gretel Killeen,Gretel Killeen,1h 23min,No especificado,No especificado
73,tt1723067,Wasteland,Movie,Michael Mackenzie,Tony Dupcinov Michael Mackenzie,1h 28min,5.1,"Phil, an unemployed bong connoisseur (Keiran King), wakes up to find his laid-back life thrown into chaos and confusion by the actions of his mate, Nick (Michael Bruce Williams), a small time hustler. Despite being sucked into a vortex of mayhem, betrayal, destructive antics and drug-consuming oblivion, Phil becomes side-tracked trying to pick up the girl of his dream... Leer todo"
74,tt8797064,National Theatre Live: Allelujah!,Movie,Nicholas Hytner Tim Van Someren,Alan Bennett,2h 50min,7.6,"The Beth, an old fashioned cradle-to-grave hospital serving a town on the edge of the Pennines, is threatened with closure as part of an NHS efficiency drive."
75,tt27439320,Ryan Sickler: Lefty's Son,Movie,Ryan Sickler,Ryan Sickler,No especificado,7.0,
76,tt0419663,Cruel World,Movie,Kelsey T. Howard,Gene Hess Paul Lawrence Paul T. Murray,1h 28min,3.7,"Reeling from his dismissal from a reality show, a deranged runner-up holds a group of co-eds hostage on the set of his own fictitious show, where losers suffer a deadly fate."
77,tt10196142,Rahman 1400,Movie,Manouchehr Hadi,Saeid Shahi Babak Kaydan Meysam Kaydan,1h 51min,4.5,Rahman is the custodian of a company and the doctor has told him that he will die soon. He decides to with the help of his friend Anush make a plan and inherit some money for his family.
78,tt7117842,Otra Boda en Castañer,Movie,Raúl García,Frankie Bracero,1h 46min,7.1,"Eduardito, the son of Dr. Zalduondo and his partner Maurice, marries. If Mariana's wedding was memorable, Eduardito has proposed that hers be even more so. It will be the first gay wedding in the traditional town of Castañer in Lares, Puerto Rico. The greatest one ever held in family and in the countryside. And you are invited. Not to be missed."
79,tt0253798,Out Cold,Movie,Brendan Malloy Emmett Malloy,Jon Zack,1h 32min,6.2,El proyecto de construir su propio parque de snowboard de este deportista de nieve se tuerce cuando una exnovia regresa a la ciudad.
80,tt2238156,Zou chu wu yue,Movie,Feng Zhu,Feng Zhu,1h 53min,6.1,
81,tt0180683,Everything's Jake,Movie,Matthew Miele,Chris Fetchko Matthew Miele,1h 32min,5.9,A homeless man takes a newly homeless man under his wing and teaches him how to survive on the streets.
82,tt13181658,Topi Ghala re,Movie,Umesh Namjoshi,Mukta Barve Priya Arun Berde Suhas Bhalekar,No especificado,No especificado,"Mumbai is rocked by Topi gang whose conning rich people over the city they also haven't spared the politicians ,The gang is run by a person called Mahaguru who operates with a large group of males and females after conning a particular person the gang parts ways and changes their looks and numbers until they find a further target.The higher officials of city like Comm... Leer todo"
83,tt0288230,King's Highway,Movie,Scott Malchus,Scott Malchus,1h 53min,6.8,"A young man in his early early 20's discovers his first love is getting married so he drops everything to travel across California and stop her, with no money and no car, where he discovers life, love and secrets from his past."
84,tt5783956,When We First Met,Movie,Ari Sandel,John Whittington,1h 37min,6.4,"Noah conoce a Avery en una fiesta de Halloween y se enamora de ella, pero se hacen sólo amigos. 3 años después ella está prometida a otra persona. Noah usa una máquina del tiempo para regresar y arreglar las cosas. ¿Funcionará?"
85,tt11646756,30 Chua Phai Tet,Movie,Quang Huy,Viet Anh Truong Giang Oanh Kieu,1h 39min,3.7,"A guy left his home for 12 years till he came back to claim what's his from his father, the vast Land, just to uncover that he had to live that day, year-end Lunar day, for another 12 years."
86,tt21824228,Jentetur,Movie,Katarina Launing,Martina Cecelia,1h 35min,5.0,"After a bad divorce life gets complicated for Linda. Her ex has found a beautiful model who gradually is more and more of a mother to Linda's 10-year-old daughter, as well as redoing their house. Even her best friend is now hers."
87,tt1314239,Eraser Children,Movie,Nathan Christoffel,Nathan Christoffel,1h 40min,4.0,"In a world of useless products, police brutality, pre-paid dreams and a list of Violations so long if you laugh too loudly you will be fined. Misner Corporation has invented a new source of energy which has given them a global monopoly on all facets of human life, creating a totalitarian society ruled by one man, Misner. Anyone not willing to work for Misner's regime,... Leer todo"
88,tt0253225,Mademoiselle,Movie,Philippe Lioret,Emmanuel Courcol Philippe Lioret Christian Sinniger,1h 25min,6.5,"Claire is a young woman who leads a somewhat formatted life. Pierre is an improviser, but not an actor. Brief encounter, brief romance, doomed or not, who can say? When things like that happen, you act on the spur of the moment."
89,tt3958276,Shinya shokudô,Movie,Joji Matsuoka,Yarô Abe Katsuhiko Manabe Kensaku Kojima,1h 59min,7.5,"A cook opens a restaurant that only serves from midnight till dawn. One day, he discovers an obituary urn. Follow the stories of his regulars tangled around this urn."
90,tt27040941,Louanna Lee and the Mansion Murder Mystery,Movie,Lee Doll,Mitch Klein,No especificado,No especificado,"Teenage detective Louanna Lee and her pal Victoria attend a birthday party for her Grandpa in an old mansion. When the lights go out, the murders begin."
91,tt0112074,The Misery Brothers,Movie,Lorenzo Doumani,Gary Ross,1h 27min,2.7,Two misfits embark upon an odyssey to reverse their unlucky family's misfortunes.
92,tt0267962,Le Sultan de la Médina,Movie,Moncef Dhouib,Moncef Dhouib,1h 38min,8.2,"Locked in a room until the release of her fiance from prison, a young woman escapes with the help of his brother."
93,tt1806798,Band on the Search,Movie,Gilbert Stark,Gilbert Stark,1h 36min,9.0,"The self proclaimed 'baddest rock band ever', sets out to find a bass player by having auditions to anyone who thinks they can fit the job. On their journey they find out more about themselves than they wanted to."
94,tt2763400,Workers,Movie,Jose Luis Valle,Jose Luis Valle,2h,7.1,"After a whole life of work at Tijuana, Rafael and Lidia are victims of injustice against their rights and dignity: Rafael learns that due to a paperwork mistake, he will not be entitled to his retirement pension. As for Lidia, she finds out that her employer's will leave the entire heirloom to the dog. In their own way, alone and silently, they'll begin a battle: Rafa... Leer todo"
95,tt2750288,Shotgun Wedding,Movie,Danny Roew,Pat Casey Josh Miller,1h 32min,5.0,"After groom-to-be Robert ""accidentally"" shoots his fiancee's maid of honor during a drunken skeet-shooting session, his meddling mother will do whatever it takes to ensure that the wedding takes place."
96,tt12781876,Mass State Lottery,Movie,Jay Karales,Jay Karales Leobardo Chacon Rodriguez,No especificado,No especificado,A private investigator manipulates a grieving mother.
97,tt0120413,The Undertaker's Wedding,Movie,John Bradshaw,John Bradshaw,1h 29min,5.2,A hapless undertaker becomes embroiled in a mafia war when he's forced to protect the brutal brother of a mob kingpin while be becomes romantically involved with the mob brother's wife.
98,tt18566076,Paydreaming,Movie,Mohamed Rabie,Mahmoud Maged,24min,7.0,"Haseb Tehlam takes viewers on a journey with Karim, who's against social media but is pressured into setting up a FB account. after sign-up, he falls prey to the latest update in the terms and conditions, which flips his life upside down."
99,tt1305854,Ga yau hei si 2009,Movie,Vincent Kok,Vincent Kok Min-Hun Fung Chun-Lam Poon,1h 40min,4.9,A man asks a womanizer to court his eldest sister in hopes of fulfilling a family marriage tradition.
100,tt0250181,97 Brooks,Movie,Mikon A. Haaksman,Mikon A. Haaksman,No especificado,5.2,No especificado
101,tt4870420,Writing Kim,Movie,Luvia Petersen Alison Ward,Alison Ward,1h 18min,6.5,"Annie, an aspiring writer, travels cross country to visit her her affluent, older, married friend Kim. As Annie's informal writer's retreat unfolds, she is increasingly inspired and intrigued by Kim's charismatic charm and fluid sexuality."
102,tt28232262,Sosyal medya,Movie,Greg Colasito,Greg Colasito,No especificado,No especificado,
103,tt6347110,Ne narushaya zakona,Movie,Anatoly Eyramdzhan,Anatoly Eyramdzhan,No especificado,No especificado,Three old Russian immigrants with criminal past try to convince young talented programmer to hack into bank of Miami.
