,0,1,2,3,4,5,6,7
589,tt8014900,The New Reality,Movie,Matthew Maclean,Matthew Maclean Edmond Magpantay,No especificado,No especificado,"Emile is an apathetic twenty-something dealing with the fallout of being cheated on. His life takes a turn for the absurd when he is reunited with his estranged mother, an impulsive free-spirit, with a passion for life."
590,tt0124622,Frække Frida og de frygtløse spioner,Movie,Søren Ole Christensen,Søren Ole Christensen Lykke Nielsen,1h 15min,4.1,
591,tt0210109,L'homme de ma vie,Movie,Stéphane Kurc,Corinne Atlas Christian Biegalski Pierre Geller,1h 24min,5.6,"Simon is getting better. His job as a publisher is going smoothly. Suddenly, out of the blue, his psychoanalyst, Charles, hits him with the news: his analysis is over. It turns out to be a nightmare. Charles also has his own dilemma: his actress wife is pregnant, but she hesitates to keep the child as she has an upcoming performance, and feels that she no longer loves... Leer todo"
592,tt0273253,Haiku Tunnel,Movie,Jacob Kornbluth Josh Kornbluth,Josh Kornbluth Jacob Kornbluth John Bellucci,1h 28min,6.1,"Josh has an offer to ""go perm"" at his employer and the first task is to mail 17 high priority letters....something that seems a little difficult to do."
593,tt0975660,The Con Man,Movie,Dave Sweeney,Dave Sweeney,No especificado,No especificado,A beautiful woman looks for revenge on a career con man by following him back to his apartment with a gun. But the con man has some tricks up his sleeve and looks to turn the tables on her. One will drink the truth serum...who will it be?
594,tt3703498,Salem Abu Ukhtuh,Movie,Mohamed Hamdy,Muhammad Samir Mabrook,1h 39min,3.2,"A poor guy called Salem works as street vendor and takes care of his sister after the death of their parents. Close people call him Salem Abu Ukhtuh (Salem, his sister's father). After the 25 January revolution, he tries to overcome the problems he faces from bullies and policemen."
595,tt3829276,El tamaño sí importa,Movie,Rafa Lara,Rafa Lara,1h 36min,4.3,"Una chica normal que no sigue los estándares de belleza convencionales intentará ganarse a su jefe, un hombre atractivo y carismático que normalmente sale con bellas actrices y modelos. Es una historia de amor diferente e impredecible."
596,tt2301157,Shoshurbari Zindabad,Movie,Debashish Biswas,Dilip Biswas,2h 40min,6.0,
597,tt0465616,Stagknight,Movie,Simon Cathcart,Simon Cathcart Rob Mercer,1h 19min,3.3,Brian and his long-estranged paintball team are back on the bus after five years and they're up for one final mission.
598,tt0985606,Eat,Movie,C. Scott Mc Coy,Laura Jean Hocking C. Scott Mc Coy,1h 27min,7.4,"An interconnected group of waiters, chefs and managers try to survive an eventful day of working, quitting, getting fired, getting drunk and hooking up."
599,tt1270791,Starlight & Superfish,Movie,Steve Kopera,Rob Hess,1h 22min,7.5,"Nick appears in his apartment - confused and disoriented. He discovers he can't move anything. He can't open the medicine cabinet, can't pick up a Perrier bottle, can't even feed his fish! A naturally nervous person, Nick panics. Suddenly, a British glam-rock band bursts in the door. The band informs Nick that he is dead, and he's stuck in his apartment. To escape, he... Leer todo"
600,tt1172997,Babysitters Beware,Movie,Douglas Horn Wallace J. Molton,Douglas Horn,1h 12min,4.2,"A young boy is determined to spend more time with his parents and attempts to behave badly enough to drive off potential babysitters, but he may have met his match in a prison guard-turned-sitter."
601,tt2011993,Pauvre Richard!,Movie,Malik Chibane,Michel Sanz Malik Chibane François Patissier,1h 30min,3.7,"It is in a small working-class district that the Eurogagnant jackpot, 124 million euros, is won - But who is the lucky winner?"
602,tt5997866,American Pirates,Movie,Jeff Knite,Jeff Knite Wilbert Stanton,1h 42min,8.1,A DVD Bootleg Pirate enlists a group of misfits who set out on an adventure to sell enough bootleg movies to make the perfect film they believe will change their lives forever.
603,tt7452382,Glue,Movie,Oisin Byrne,Gary Farrelly Violet Ogden Fiona Byrne,52min,No especificado,"Told through confessional monologues and dialogues, Gary,a cross-dressing narcoleptic, delivers a radical and comic insight into our shattered subjectivity."
604,tt1385903,Das große Glück sozusagen,Movie,Alexander Stecher,Alexander Stecher,53min,7.8,"Georg is a writer hoping for the big breakthrough. When he meets unemployed Alois, he finds in him the material for a novel, which he has been desperately looking for. Alois has a strange habit: In a seemingly pointless way, he gets the people around him involved in absurd situations. When Georg decides to get to the bottom of Alois's behavior, he becomes entangled in... Leer todo"
605,tt0398982,Duane Hopwood,Movie,Matt Mulhern,Matt Mulhern,1h 24min,6.5,A down-on-his-luck divorced father struggles to get his life and family back together before it's too late.
606,tt1381418,You May Not Kiss the Bride,Movie,Rob Hedden,Rob Hedden,1h 39min,5.4,"An unassuming pet photographer is thrown into serious action, adventure and romance when he's forced to marry a Croatian bride and spend his honeymoon at a remote tropical resort where she is kidnapped."
607,tt3772700,The Tour,Movie,Mark Amos,Mark Amos Jeremy Briggs,1h 47min,No especificado,"Four friends take their garage band on a tour of their hometowns despite the facts that they've never recorded an album, played before an audience or even written a song. They set all personal responsibility on the back burner to chase a younger man's dream."
608,tt0177905,Likhaya parochka,Movie,Arkadi Sirenko,Vladislav Romanov,No especificado,No especificado,
609,tt2573536,"Nejem, nõm, csajom",Movie,Péter Szajki,Péter Szajki Adél Vörös Iván Angelusz,1h 37min,5.7,The stories of three women and a man who have to learn something new about their partners that make them think their relationships over.
610,tt0313484,Plenniki udachi,Movie,Maksim Pezhemskiy,Maksim Pezhemskiy,1h 20min,4.5,
611,tt6573604,Minu näoga onu,Movie,Andres Maimik Katrin Tegova,Andres Maimik Katrin Tegova,1h 50min,6.7,"A music critic Hugo, suffering from post-divorce depression, is just about to rebuild his life when his jazz musician father Raivo arrives at his door unexpectedly. Spiteful old man announces that he will soon come to his end and expects his only son to take care of him. When an attractive psychotherapist enters the men's lives, the father and son duo begin to compete... Leer todo"
612,tt15824982,Blinnaya mashina,Movie,Oleg Mavromatti,Oleg Mavromatti Kana Se Denis Streletskiy,1h 17min,No especificado,"The young vlogger Maxim shares revelations about his life, women and capitalism before making the decision of sex change. Already a woman, she talks about the transformation and how life as a woman is not what she expected."
613,tt4086018,Charming,Movie,Ross Venokur,Ross Venokur,1h 25min,5.6,"Tres princesas de cuento de hadas están comprometidas con el mismo tipo, el Príncipe Encantador."
614,tt0257727,Die Gottesanbeterin,Movie,Paul Harather,Susanne Freund Gerda E. Grossmann Paul Harather,1h 33min,6.4,"When Trixi's first husband says she can only continue to bet at the racetrack ""over his dead body"", she takes him literally. Trixi then goes on to find wealth and happiness by poisoning more husbands to inherit from them."
615,tt1537350,Vegas Date,Movie,Kevin Birnbaum,Kevin Birnbaum,1h 20min,No especificado,A black gansta' rapper and a blonde white diva are made to go out on a date for a Reality TV show on the Vegas Strip with disastrous consequences.
616,tt1287349,Saade Maade Teen,Movie,Ankush Chaudhari Sachit Patil,Sanjay Mone,2h 5min,6.4,"Ratan runs garage with his brother's, Madan and Chandan, and hates girls and doesn't want his brother's also to fall in love but Chandan falls for Madhura but will Ratan agree on this."
617,tt7201818,Bite Me,Movie,Meredith Edwards,Naomi Mc Dougall Jones,1h 23min,5.6,"When Sarah, a real-life vampire, gets audited, the last thing she expects is a date. But an unlikely spark with IRS agent, James, forces two misfits to confront whether they have the courage to commit the radical act of falling in love."
618,tt1445520,Footnote,Movie,Joseph Cedar,Joseph Cedar,1h 47min,7.1,"Eliezer and Uriel Shkolnik are father and son as well as rival professors in Talmudic Studies. When both men learn that Eliezer will be lauded for his work, their complicated relationship reaches a new peak."
619,tt9364382,Gritty Romance,Movie,William Hadden,William Hadden,No especificado,No especificado,
620,tt8610850,Da unten im Himmel,Movie,Felix Schäfer,Felix Schäfer,1h 22min,7.1,"Seis hombres se encuentran en una fiesta sorpresa. Una nota dejada atrás revela que son parte de una intervención terapéutica. De mala gana, se rinden a su destino y se embarcan en un viaje para explorar su propio ser."
621,tt6426184,William Shakespeare's a Midsummer Night's Dream,Movie,Lolo Loren,Lolo Loren Patrick Poe William Shakespeare,2h 33min,No especificado,"This un-abridged fresh take on William Shakespeare's riotous comedy ""A Midsummer Night's Dream"" is the truest adaption to Shakespeare's original text yet to see the screen. A tale of wonder, magic, love, and mayhem, ""A Midsummer Night's Dream"" follows the lovers Lysander and Hermia, as they run away to the woods to try and escape the wishes of Hermia's father, Egues, ... Leer todo"
622,tt0156533,Fiori di zucca,Movie,Stefano Pomilia,Stefano Pomilia,1h 37min,4.9,"The story revolves around three former schoolmates who find themselves casually in a street in Rome, where a childhood friend had had a fatal accident some time before."
623,tt1833206,Ann Richards' Texas,Movie,Jack Lofton Keith Robert Patterson,Keith Robert Patterson Adam Fowler,1h 29min,7.9,"In a state where even the road signs are macho, an unlikely political outsider emerged to take on the power structure. The leader who came of age during the high tide of modern conservatism, changing Texas and the country - did it in heels."
624,tt8800384,Posljednji Srbin u Hrvatskoj,Movie,Predrag Licina,Predrag Licina,1h 25min,5.9,"Croatia, seven years after bankruptcy. There is a fight going on in the world - water has become more precious than oil. In order to get hold of it, the powerful are ready to start wars, conquer, destroy, and even plant a zombie-virus. Mico, a bon viveur from Zagreb, whose daily routine includes massage parlours, restaurants and cinemas, where he watches a movie serie... Leer todo"
625,tt5580902,Fanatic,Movie,Charlie Nguyen,Charlie Nguyen Duc Nguyen,1h 43min,6.7,A story about the guy trying to revive Rock industry of Vietnam.
626,tt0186453,"Plus qu'hier, moins que demain",Movie,Laurent Achard,Laurent Achard Ricardo Muñoz,1h 26min,7.0,"A young woman's return home brings up troubles from the past, while her teenage sister is anxious for the future."
627,tt6338372,Evans Getting It Together: Based on a Shoe Story,Movie,Casson Demmon,Kevin Freeney,1h 29min,No especificado,No especificado
628,tt0204932,Den bästa sommaren,Movie,Ulf Malmros,Ulf Malmros Vasa,1h 31min,7.3,Two kids move in with a lonely undertaker who is secretly in love with the town's school teacher.
629,tt10540150,1st Rank Raju,Movie,Naresh Kumar,Ananth Aryan Basha,2h 8min,5.0,"A studious and obedient youngster follows his father's advice and memories all his study material to achieve the first rank in his academic career, but will he be equipped to succeed in the real world as well?"
630,tt0479717,Miya Biwi Aur Saali,Movie,No especificado,No especificado,No especificado,7.1,
631,tt3164938,A Road Trip Story,Movie,Charles Wallace,Charles Wallace,No especificado,No especificado,No especificado
632,tt0907113,Comic Evangelists,Movie,Daniel Jones Dann Sytsma,Dann Sytsma Daniel Jones Eli Rix,1h 15min,7.7,"An atheist and eight Christian comedians travel to an improv festival to spread the Good Word. Will their own secrets and lies, and their lack of talent, tear them apart?"
633,tt0439709,Monarch of the Moon,Movie,Richard Lowry,Richard Lowry Chris Patton,1h 38min,5.6,"This is the battle to end all battles and pulse-pounding World War II action and intergalactic intrigue! Defending freedom and democracy is the incredible Yellow Jacket, Army fighter pilot turned winged superhero, now leading America's charge against Evil! He must battle the deliciously deadly DRAGON FLY and her JAPBOTS, outsmart an infamous Nazi scientist and destroy... Leer todo"
634,tt0112627,Captiva Island,Movie,John Biffar,John Biffar Bill Schreiber,1h 25min,5.8,"While vacationing on Captiva Island, Florida with his parents, a teen, gloomy about his future, finds love and friendship when he meats a cute girl and 3 kooky pensioners with passion for life and crazy schemes."
635,tt11738338,Groundhog Dave 2,Movie,James Snider,BC Fourteen,1h 8min,6.2,"Its almost springtime, and the whole town eagerly awaits Groundhog Daves annual end-of-winter presentation - but this year, Daves had a startling premonition that foretells the end of the world. Teaming up with his loyal friend, Chester the reindeer, Dave sets out to discover the meaning of his vision and save the world, meeting many colorful friends and foes along th... Leer todo"
636,tt0455805,Then She Found Me,Movie,Helen Hunt,Elinor Lipman Alice Arlen Victor Levin,1h 40min,5.9,Una profesora de Nueva York sufre una crisis aguda debido a una serie de desdichados sucesos; su único consuelo será el padre de uno de sus alumnos.
637,tt5247762,Jiang shi wang ye,Movie,Pingyuan Zhang,Chao Xiao Jialin Zhang,1h 2min,No especificado,
638,tt1679263,Fotki,Movie,Lera Mulina,Lera Mulina,1h 47min,5.9,"A young photographer, Julia, makes a disastrous set of photos. She comes to a meeting with a client and he blows her up with his friend, a professional skilled photographer. The dispirited girl steals an expensive photo-album from the photographer. After while some strange distressing events start to happen with her. And one of her best friends suggests her to return ... Leer todo"
639,tt2108516,Finalmente la felicità,Movie,Leonardo Pieraccioni,Domenico Costanzo Leonardo Pieraccioni Giovanni Veronesi,1h 33min,5.3,"A music professor who lives in Lucca is contacted by a television broadcast, where he discovers that his mother, years ago, had adopted a Brazilian girl, who has now become a beautiful model."
640,tt6623826,The Atomic Zombie Space Creeps,Movie,Aaron James Martin,Aaron James Martin,54min,3.2,A race of aliens decide to destroy the world to prevent mankind from spreading war and destruction across the stars. When one of them decides to take a stand and band together with a human ally a race is on to save the Earth from an invasion of atomic powered zombies and killer robots.
641,tt0245055,Cinderella; Single Again,Movie,Kellie Ann Benz,Kellie Ann Benz Jacob Grimm Wilhelm Grimm,No especificado,7.7,Cinderella's life after her separation from Prince Charming.
642,tt2475826,Go for Broke,Movie,Ethan Dawes,Ethan Dawes,1h 10min,7.2,"After a series of frustrating events throw Max Greene over the edge, he and three friends take an impromptu trip to the desert to clear their heads and reassess their lives."
643,tt0475394,Smokin' Aces,Movie,Joe Carnahan,Joe Carnahan,1h 49min,6.6,"Buddy Israel, informador en Las Vegas, testifica contra una organización que a consecuencia querrá matarle."
644,tt3551714,The Good Boys,Movie,Jacob Swauger,Jacob Swauger,1h 36min,6.0,No especificado
645,tt2325474,Shoping-tur,Movie,Mikhail Brashinskiy,Mikhail Brashinskiy,1h 10min,4.4,"A group of Russian tourists go on a shopping spree to the neighboring Finland - only to be attacked by the Finnish cannibals. We focus on a middle-aged woman and her teenage son who is shooting the film, as we watch it, on his cell-phone."
646,tt3611332,Welcome to Forever,Movie,Joe Flanders Patrick Fogarty,Graham Bowlin Joe Flanders,1h 13min,No especificado,"In one last-ditch effort to reconnect, three old friends take a weekend getaway to a cabin in the Appalachian mountains, along with three outsiders to buffer awkward conversation. All of them are pushing thirty, and all stand on the cusp of adult life, forced into a future they don't feel prepared for. Being confined in one cabin together forces the trio to confront m... Leer todo"
647,tt0409506,You Are Here,Movie,Erin E. Mac Millan,Erin E. Mac Millan,1h 31min,4.9,"In this fast paced take on life, Four stories unfold, weave and warp as secrets are revealed, hearts are broken, fortunes are lost, and lives hang in the balance. In moments of love and betrayal, No Matter What, YOU ARE HERE."
648,tt6296952,Incontriamoci,Movie,Sandra Rossi,Gualtiero Serafini,1h 20min,No especificado,Claudia follows her dream of being an actress. Roberto hides something. Sara is Claudia's best friend and she has been fired. The frustration of young artists and a series of events will lead to the birth of a non-profit organization where dance and music will put all different ethnicities together.
649,tt0203166,Tillsammans,Movie,Lukas Moodysson,Lukas Moodysson,1h 46min,7.4,"In 1975, the dynamics of a Swedish commune begin to change upon the arrival of a beaten wife and her two kids."
650,tt1721691,"The Long, Slow Death of a Twenty-Something",Movie,Larry Longstreth,Larry Longstreth,1h 13min,7.0,"Ben Baker is a mediocre person at a mediocre job and spends most of his time drinking, smoking pot and playing video games and Dungeons & Dragons. All is well, until a rather unexpected thing happens to him and everyone he knows....the big ""3-0"". Follow Ben as he goes through a series of hilarious coming-of-age adventures and awkward mishaps to find his sense of purpo... Leer todo"
651,tt1631359,Maggie Marvel,Movie,Dan Brennan,Dan Brennan,1h 30min,6.6,"About a single Mom who moonlights as a contract killer. Maggie Marvel must balance career and family, murder and math homework. She is pushed into this dangerous world... only to find out she is very good at it."
652,tt1756789,The Argues: The Movie,Movie,Mark Hembrow,David Argue Patricia Argue Mark Hembrow,1h 20min,7.2,"THE ARGUES THE MOVIE is a story of how a son, a mother, and a duck named Leon Skank assault the Hollywood star system in an attempt to secure work through one of the biggest international actors? agents in the world; Ed Tomato at ICU Management Los Angeles. However, things don?t go so well! The nerves of both mother and son are starting to fray and temperature has bec... Leer todo"
653,tt21079594,Cheesecake and Rainbow Tights,Movie,T.C. De Witt,Emily Ember Kristen Mc Cabe,8min,No especificado,"Cousins Alexis and Cassie are roommates just trying their best to make it through the world. While Alexis prepares a cake for her boyfriend, Cassie prepares for her first day of work, with only minor complications along the way, one of which is the required ensemble Cassie is required to wear for this mysterious new job."
654,tt13869038,You're OUT!,Movie,Katharin 'Ladie K' Mraz,Sandy De Lisle,No especificado,9.0,"A former Minor League pitcher projects his Major League aspirations on his 17-year-old son, taking him on a desperate cross-country road trip to get him recruited by a college baseball team."
655,tt2915016,Émilie,Movie,Guillaume Lonergan,Francis Delfour,1h 28min,5.1,Émilie is a multi-platform romantic comedy. It is a fragmented story that unfolds across multiple media platforms. The basic idea is simple: to use a variety of broadcast and communication tools to tell a story and give the user a completely different experience. At the heart of the Émilie web series are the interactive videos in which characters call users on their c... Leer todo
656,tt3459874,Homophobic Friends,Movie,Tijana Mamula,No especificado,50min,No especificado,No especificado
657,tt8443542,The Acting Bug & Other Stories,Movie,Jarret Liotta,Jarret Liotta,No especificado,No especificado,No especificado
658,tt10360878,Munda Hi Chahida,Movie,Paramjit Singh Deepak Thaper Santosh Thite,Deep Jagdeep Jaedy Santosh Thite,2h 10min,6.5,"Munda Hi Chahida revolves around a man called Dharminder who lives together with his father and grandmother, his three sisters and two daughters. He is desperately hoping for his next child to be a son. He feels suffocated surrounded by the women in his house and everywhere around him. In a desperate attempt to make his wish come true, he becomes superstitious and con... Leer todo"
659,tt1454991,Gabriel Small,Movie,Jordan Morris,Jordan Morris,1h 31min,8.6,"A young man thrives in his solitude and has a very clear view on the direction of his life. That is until the simple idea of getting a cactus for his work station sends him on a path of self discovery that he could never have anticipated. We follow Gabriel as he fathoms the ways of women, grinds away at his menial job and partakes in bizarre and juvenile conversations... Leer todo"
660,tt1306952,Aim Away from Face,Movie,Brandon Swanson,Brandon Swanson Travis Von Rotz,1h 29min,8.9,"A lazy entrepreneur and his broke sidekick sell patriotism by the package to hapless mountain folk, only to find their July Fourth could be ruined by the ultimate American establishment: competition."
661,tt2106774,The Period,Movie,J. Douglas Smith,J. Douglas Smith,1h 45min,5.5,Sharrie Heiman suddenly finds herself with a never ending projectile period.
662,tt0255627,Swastham Grihabaranam,Movie,Ramasimhan,Sidheeque Thamarasseri,No especificado,3.2,"Unni, a fishmonger, is the son of a reputed social worker. Soon, he faces a series of challenges as he gets into trouble with Moosa, the village thug."
663,tt2380331,Words and Pictures,Movie,Fred Schepisi,Gerald Di Pego,1h 51min,6.6,Un profesor de arte y un profesor de inglés forman una rivalidad que acaba en una competición en su escuela en la que los alumnos deciden si las palabras o las imágenes son más importantes.
664,tt27996301,Gulaam Chor,Movie,Viral Shah,Hardik Sangani Viral Shah,1h 53min,7.0,"The film centers around a high-stakes gambling session during a house party, where twelve individuals come together with hopes of winning a massive sum of Rs 12 crore. However, when the lights suddenly go out at midnight, the money vanishes, leaving everyone bewildered and suspicious of each other."
665,tt13130666,SexSquatch 2: TeenApe Vs. Sexsquatch,Movie,Chris Seaver,Chris Seaver,59min,4.6,"Years have passed since the sexual onslaught of Stinkfist, The Sexsquatch, a horned up Big Foot like beast who killed and violated the nubile teens at Blood Stool Creek. But you can't keep an interstellar sexual species like the Sexquatch down for long. Another of the species, FIST STINK, has landed on Earth to unleash his own special brand of love on the population. ... Leer todo"
666,tt12663654,Remnants,Movie,Jackson Buckley,Jackson Buckley,1h 29min,No especificado,"Remnants follows Chris, who lost his dad to a cynical warlord, Purple Swordsman. He's taken under the wing of his father's friend, Milo. Together they must find out what happened to Chris's father and stop Purple Swordsman at all costs."
667,tt2266811,Professor Quixote,Movie,Jenny Hoffman John Eric Patelzick,Jenny Hoffman,1h 8min,No especificado,No especificado
668,tt5516168,Silent But Deadly,Movie,Paul Dale,Paul Dale Dylan Mc Govern,1h,5.6,"A killer mime is on the loose, taking out a troupe of teen tropes (Alliteration Eh) in this outrageous horror comedy. It's got something for everyone, unless of course you are a child, my mother, or have any taste."
669,tt20222080,Beauty Shop Chronicles,Movie,Tyler Maddox,Tyler Maddox Travis Williams,No especificado,No especificado,No especificado
670,tt10742934,La noche mágica,Movie,Gastón Portal,Gastón Portal Javier Castro Albano,1h 33min,6.4,"Una pacífica Nochebuena se interrumpe cuando un ladrón irrumpe en una casa. Con lo que no cuenta es con la pequeña hija de la familia, que lo confunde con Santa Claus y le pide que cumpla su lista de deseos navideños."
671,tt0107766,"Pacco, doppio pacco e contropaccotto",Movie,Nanni Loy,Nanni Loy Elvio Porta,1h 58min,6.7,
672,tt3848888,The Shaukeens,Movie,Abhishek Sharma,Sai Kabir Tigmanshu Dhulia,2h 4min,4.8,Three friends in their 60s try to do everything that they couldn't do in their younger days - before death arrives.
673,tt1284977,Corpse Run,Movie,John-Michael Thomas,John-Michael Thomas,1h 41min,7.4,A coming of age story about video games and their affect on the current twenty-something generation.
674,tt1821455,Heniek,Movie,Eliza Kowalewska Grzegorz Madej,Eliza Kowalewska Grzegorz Madej,1h 12min,6.4,True story about Polish car dealers who are capable of stilling each other for better life. The picture of the new Polish middle class after Communism breaks down.
675,tt1132135,Asylum Seekers,Movie,Rania Ajami,Rania Ajami Jake Pilikian,1h 34min,4.4,"Six people on the verge of a breakdown decide to check themselves into an insane asylum, only to discover there is just room for one."
676,tt2126336,Nuvvila,Movie,Ravi Babu,Ravi Babu Satyanand,2h 19min,6.6,Three boys who work at a pizza store are thrown into three different stories when one boy had to cover for another boy and make a delivery.
677,tt0190217,"30, Still Single: Contemplating Suicide",Movie,Gregory J. Lanesey,Gregory J. Lanesey,1h 31min,7.6,"A Midwesterner, now living in Los Angeles, recounts his romantic misadventures in flashback over the seven years he has lived there. Struggles include an asthma attack, a bout with a woman who later admits to having herpes, the perennial sexual dynamo, and ultimately masturbation. Throughout, our narrator reflects on his misguided attempts to understand the female ani... Leer todo"
