,0,1,2,3,4,5,6,7
0,tt26245586,The Invited,Movie,Davy Mc Guire Kristin Mc Guire,Richard Hurford Ben Steiger-Levine,15min,No especificado,Reimagines the gothic story of Dracula in a solitary séance in which a handcrafted fine art pop-up book comes to life with vivid augmented reality animations to serve as a conduit for Dracula's curse to re-enter the modern world.
1,tt15662984,In Another Life,Movie,Belinda Agedah Yanga,Echobu Michael Garuba Emil Garuba Brenda Ogbukaa-Garuba,No especificado,No especificado,A wife and working mother finds herself living the life she always wanted after she inadvertently makes a wish on her 35th birthday but soon discovers that the grass isn't always greener on the other side.
2,tt0195859,Nachtmusik,Movie,No especificado,No especificado,No especificado,No especificado,No especificado
3,tt5075662,The Isle,Movie,Matthew Butler-Hart,Matthew Butler-Hart Tori Butler-Hart,1h 36min,4.9,"Cuando su barco se hunde, 3 hombres llegan a una isla de la que no podrán escapar."
4,tt16474872,5 histoires... de science-fiction,Movie,Christine Guilbaud Paul Jacamon Olivier Jean,Alexandra Ansidei Marie-Christine Barrault Christian Charmetant,58min,No especificado,"Features five French innovative science fiction and fantasy shorts, produced and directed by the new generation of Gallic cinema: ""L'empreinte de l'ange""; ""Orbital Tango""; ""Cafard""; ""Murielle, moi non plus""; and ""The Venus Project""."
5,tt3887196,Blue Sapphire Jazz Nights,Movie,Omer Pasha,Omer Pasha,2h 5min,No especificado,"Jazz Musical with relaxing jazz piano music featuring beautiful men and women celebrating their romantic lives in Vancouver, BC, Canada."
6,tt0098658,Wings of Fame,Movie,Otakar Votocek,Herman Koch Otakar Votocek,1h 49min,6.9,"A famous movie actor (Peter O'Toole) claims that he has written a book. As result, a real author, not a very well known writer, vengenfully kills him but then dies as a result of an accident. Next, they both find themselves in after-life, where souls of all famous people are gathered."
7,tt1858396,Arai Enn 305-il Kadavul,Movie,Chimbudeven,Chimbudeven,2h 44min,5.8,"The story revolves around two unemployed youths who are struggling to make ends meet. At one situation they blame the God for all their sufferings. The God appears and decide to stay with them. Realizing the power of God resides in a ""Galaxy Box"" the youths steal it. By stealing it they become God and God ends up becoming a normal man. While the youths misuse the powe... Leer todo"
8,tt2262081,Seninki kaç para?,Movie,Hakki Görgülü,Hakan Gök Hakki Görgülü,No especificado,4.1,
9,tt16235600,Chhota Bheem aur Krishna: Mayanagari,Movie,Rajiv Chilaka,Rajiv Chilaka,1h 6min,8.2,"After Krishna stops Maayandri from releasing her brother, Kirmada, Maayandri decides to exact revenge on him. Later, Bheem and his friends set out to rescue Krishna and defeat Maayandri."
10,tt3876598,G2: Heroes (Guardians of the Confluence 2),Movie,Christopher J. Tomlinson,Adam Rosenbaum Christopher J. Tomlinson,No especificado,No especificado,No especificado
11,tt7946836,Dong wu shi jie,Movie,Yan Han,Nobuyuki Fukumoto Yan Han,2h 12min,6.4,A man finds himself deep in debt and is coerced to board a ship that hosts a risky gambling party.
12,tt0325030,Il est plus facile pour un chameau...,Movie,Valeria Bruni Tedeschi,Valeria Bruni Tedeschi Noémie Lvovsky Agnès de Sacy,1h 50min,5.7,"As a little girl, Federica fantasized about having beautiful long hair that would grow back as soon as she cut it, about never-ending cones of cotton candy and about countless adventures that took her to the far side of the world. Now a charming thirty-something-single woman, Federica's fantasies have evolved, adding lovers, stardom, and motherhood to her waking dream... Leer todo"
13,tt0422151,Dyesebel,Movie,Mel Chionglo,Ricky Lee Mars Ravelo Elpidio Torres,1h 41min,5.6,A MERMAID REALIZED HER DREAM TO BE FULLY HUMAN AND LIVE WITH THE MAN SHE LOVES.
14,tt14110924,Mislandia,Movie,Mashti Allan,Zahara Johannes Ross Johnson Aleks Nial,1h 57min,7.4,"A series of strangers appear in a strange alien looking city with no recollection of who they are, and are given new names by the mysterious ""King Alpha."" They must work together to find out who and where they are, before they lose their sanity."
15,tt5463052,Persona 3 the Movie: #4 Winter of Rebirth,Movie,Tomohisa Taguchi,Jun Kumagai,1h 45min,7.1,The season changes to winter. Makoto makes a decision in order to greet the spring that is waiting beyond.
16,tt6879318,Italy Italy,Movie,Kaveh Sabbaghzade,Jhumpa Lahiri Kaveh Sabbaghzade,1h 42min,5.4,Barfa and Nader meet each other and get marry but little by little their life begin to reach it's crisis levels.
17,tt0467128,Wallonie 2084,Movie,Vincent Hachet Jean-Jacques Rousseau,Vincent Hachet Jean-Jacques Rousseau,1h 20min,3.8,No especificado
18,tt6133484,Raakshas,Movie,Dnyanesh Zoting,Tanmayee Deo Dnyanesh Zoting,1h 55min,7.4,"A Documentary Film maker, who is covering the protest of a remote forest tribe, goes missing. His little daughter, who spends most of her time reading fairy tales, accompanies her mother in search of the man. The quest gets fulfilled when the reality and fantasy come together to unfold an ancient tribal myth."
19,tt3257582,Pokémon: Genesect en de ontwaakte legende,Movie,Kunihiko Yuyama,Hideki Sonoda Satoshi Tajiri Junichi Masuda,1h 36min,5.5,"Ash, Pikachu, and friends must stop Mewtwo and a group of Genesect from the destroying the city."
20,tt0422946,Petrang kabayo 2: Anong ganda mo! Mukha kang kabayo,Movie,Luciano B. Carlos,Pablo S. Gomez Nestor Malgapo,1h 53min,5.6,No especificado
21,tt2170242,Yellow Day,Movie,Carl Lauten,G.P. Galle Jr.,1h 38min,4.9,"Este campamento celebra los milagros, la fe y la comunidad, pero para un joven es la oportunidad de encontrar su verdadero amor. En este viaje conoce a una niña que le muestra el camino y su vida se fortalece para siempre."
22,tt0467817,Buitenspel,Movie,Jan Verheyen Pieter Van Hees,Frank Ketelaar Ed Vanderweyden,1h 30min,5.9,"Gilles, a 12-year-old boy from the Brussels region, is a football (soccer) player. His dream is to become a member of the Belgian National Squad, the so called ""Red Devils""."
23,tt15448906,Telescope,Movie,M.B. Padmakumar,M.B. Padmakumar,No especificado,No especificado,"Some people (Dalit, Muslim, Hindu, officer, revolutionary, teacher, woman, child) end up in a pit. Their fear of death brings them closer. Their innate behaviours reveal often. They can only escape if they bury their prejudices."
24,tt1424366,Nang mai,Movie,Pen-Ek Ratanaruang,Pen-Ek Ratanaruang,1h 49min,6.1,An urban husband and wife travel to the jungle and learn just how precious their relationship is.
25,tt5822384,Lao Ye Bao He: The Sisyphus,Movie,Gongming Chan,Zhuoxin Cai,No especificado,No especificado,Can an imperfect God be God when the twist of fate makes it impossible for him to grant himself a wish that can never be granted?
26,tt15298026,The Waiting Room,Movie,Michael Fenton Crenshaw Kenton Elbert Jnr Nat Nollid,Michael Fenton Crenshaw,52min,No especificado,"This film is for contemplation and the realisation that existence may be an inherent illusion, there is no time, existence or substance to anything. The soundtrack has 30 different voices in French, Italian, English, Spanish, Japanese and Korean. This film gently glides from person to person and is useful for meditation and thought. Stacklands Monastery in Kent is int... Leer todo"
27,tt4526136,Scales: Mermaids Are Real,Movie,Kevan Peterson,Kevan Peterson,1h 32min,4.1,"A young girl faces the bittersweet reality that, on her upcoming twelfth birthday, she is destined to turn into a mermaid."
28,tt0102162,Jiu tian xuan nu,Movie,Jun-Kit Lai,Wai Chung Philip Kwok Jun-kit Lai Ke-chung Wu,1h 34min,5.6,"A local vigilante and a prostitute, who is the reincarnated spirit of a female warrior, battle an evil magician."
29,tt13812996,Sinbad and the Pirate Princess,Movie,Mark Redfield,Mark Redfield,1h 15min,No especificado,"A ferocious pirate roams the Arabian Sea, and Sinbad must stop her."
30,tt13204756,Apps,Movie,Sandra Arriagada Camilo León Lucio A. Rojas,Sandra Arriagada Diego Ayala Camilo León,1h 31min,5.7,Cuatro historias donde una aplicación abrirá las puertas al terror.
31,tt8887910,"Dead Ones, do You Live?",Movie,Gabriela Greeb,Luciana Domschke,1h 13min,No especificado,"Biography of Hilda Hilst, brazilian poet."
32,tt1798110,Bel Alwan ElTabeaya,Movie,Osama Fawzy,Hani Fawzi,1h 38min,5.7,"The film revolves around Joseph student at the Faculty of Fine Arts, who responded to the call of talent and love of drawing against the family's wishes, which she dreamed By joining the faculty of medicine. Over the years of study within the Faculty of Fine Arts, just his personality changed and becomes in confusion case with his religious ideas."
33,tt0136132,Ejacula 2,Movie,Max Bellocchio Mario Pollak,Max Bellocchio,1h 28min,6.3,No especificado
34,tt0340096,The Emperor's Wife,Movie,Julien Vrebos,Paul Ruven,1h 40min,5.4,"In a vast empire where tradition is law, an emperor's devoted chamberlain (Jonathan Rhys Meyers) swears to help him find the perfect bride in this royal romance filled with palace intrigue."
35,tt4463248,Le fantôme de Canterville,Movie,Yann Samuell,Oscar Wilde Yann Samuell,1h 30min,4.3,"In the depths of a British legend, the ghost of Eleanor Canterville is condemned to haunt the castle of his family and to scare away any inhabitant. It fulfills this task perfectly, helped by Gwilherm, his faithful servant. But when Otis, a family fleeing Parisian life, buy the castle, Eleanor is upset because she cannot scare this tribe of the twenty-first century. W... Leer todo"
36,tt4731136,A Cure for Wellness,Movie,Gore Verbinski,Justin Haythe Gore Verbinski,2h 26min,6.4,"Un joven y ambicioso ejecutivo es enviado a buscar al director de su empresa a un idílico pero misterioso ""centro de bienestar"" en un lugar de los Alpes suizos, pero pronto sospecha que los tratamientos del spa no son lo que parecen."
37,tt1720297,Yong xin tiao,Movie,Stanley Kwan,Jimmy Ngai,1h 40min,4.5,
38,tt2017561,Xi you: Xiang mo pian,Movie,Stephen Chow Chi-Kin Kwok,Stephen Chow Chi-Kin Kwok Xin Huo,1h 50min,6.7,"Tang Sanzang, an aspiring Buddhist hero tries to protect a village from three demons. He develops complex feelings for Miss Duan, the demon hunter who repeatedly helps him, and finally quests to meet the legendary Monkey King."
39,tt2480784,Which Way Is the Front Line from Here? The Life and Time of Tim Hetherington,Movie,Sebastian Junger,Chris Anderson Peter Bouckaert James Brabazon,1h 18min,7.7,"Documentary about deceased photojournalist Tim Hetherington directed by Sebastian Junger. Together with his friend and long-term collaborator Sebastian, Tim had travelled the world documenting conflicts in Afghanistan, Liberia and Libya among other locations. Best known for their 2010 film 'Restrepo' which was nominated for an Academy Award, the two strived to capture... Leer todo"
40,tt5606664,Doctor Sleep,Movie,Mike Flanagan,Mike Flanagan Stephen King,2h 32min,7.3,"Años después de los acontecimientos de El resplandor, Dan Torrance debe proteger a una joven con poderes similares de una secta conocida como el Nudo Verdadero, que se aprovecha de los niños con poderes para conseguir la inmortalidad."
41,tt4761444,Aimee,Movie,Oscar Pichardo Isaak,Oscar Pichardo Isaak,1h 14min,No especificado,"'Aimee' is a psychological thriller about a man who seeks to kill a woman he has loved in the past. It portrays the psychotic love that he feels for a voice he hears, from its departure until their first encounter. Our protagonist will look back at his life, remembering all of the women he has loved since puberty. Stalking women walking down streets, he becomes obsess... Leer todo"
42,tt11368108,Thistle,Movie,Bash Dinsmore,Bash Dinsmore Marcus Fforde David Reid,No especificado,No especificado,Scotland and England have been at war for years. After the death of Richard DinesMurray was stops so a treaty of peace can be signed until the body of Jamie McDonald is found in the streets hung upon a spike. Robert and his friends must reclaim the throne of Scotland.
43,tt7488208,Over the Moon,Movie,Glen Keane John Kahrs,Audrey Wells Jennifer Yee Mc Devitt Alice Wu,1h 35min,6.3,"Impulsada por su determinación y su pasión por la ciencia, la pequeña Fei Fei construye un cohete para viajar a la luna y probar la existencia de la legendaria Diosa de la Luna descubriendo un mundo de criaturas maravillosas."
44,tt0120142,The Sixth Man,Movie,Randall Miller,Christopher Reed Cynthia Carle,1h 47min,5.6,A college athlete returns from the dead to help his brother's basketball team win the NCAA title.
45,tt1332516,Esprit es-tu là?,Movie,Philippe Vallois,Philippe Vallois,1h 38min,6.7,"In the mid-nineties, a young writer, victim of AIDS, wants to ensure from the beyond that his lover receives a camera with supernatural powers, hoping that this will revive his lover's will to live and connect with him."
46,tt6325386,Omni: Verse,Movie,Grier Dill Sean Gill Julie Gomez,Julie Gomez Tessa Greenberg Mike Holt,1h 34min,8.0,No especificado
47,tt0114812,Urnebesna tragedija,Movie,Goran Markovic,Dusan Kovacevic,1h 35min,7.2,"In a way of protesting for inhuman living conditions and the shortage of medications caused by the disintegration of Yugoslavia and its sanctions, a doctor in a hospital decides to close his clinic for mental illness. His wish is to return the patients to their homes or give them to someone who is willing to accept them temporarily. Since one of the patients is planni... Leer todo"
48,tt1179254,L'amour fou,Movie,Michel Rodde,Michel Rodde,1h 25min,No especificado,No especificado
49,tt2164320,Cortos Interruptus,Movie,Albi De Abreu Miguel Ferrari Gastón Goldmann,Albi De Abreu Miguel Ferrari Gastón Goldmann,1h 30min,8.7,Five Stories separate about our inability to face our own fears and shortcomings as human beings.
50,tt1374992,Upside Down,Movie,Juan Solanas,Juan Solanas Santiago Amigorena Pierre Magny,1h 49min,6.3,"Adam y Eden se enamoraron en la adolescencia a pesar de vivir en mundos gemelos con gravedades en direcciones opuestas. Diez años después de una separación forzada, Adam emprende una peligrosa búsqueda para reencontrarse con su amor."
51,tt1596342,Disenchanted,Movie,Adam Shankman,Brigitte Hales J. David Stem David N. Weiss,1h 59min,5.6,"Diez años después de su ""y vivieron felices para siempre"", Giselle se cuestiona su felicidad, sacudiendo las vidas de todos a su alrededor, tanto en el mundo real como en Andalasia, en el proceso."
52,tt0124800,Mr. Atlas,Movie,Karen Arbeeny,Elaine Chekich,1h 39min,5.2,"Danny goes for a stroll one day when he unwittingly falls into a deep hole. Unable to get out, the boy begins to search around and finds himself face-to-face with the Greek god Atlas, the man with the world on his shoulders."
53,tt3531852,Bhoothnath Returns,Movie,Nitesh Tiwari,Piyush Gupta Shreyas Jain Nikhil Mehrotra,2h 35min,6.6,"A ghost returns back from his world to prove something. But on earth, he has something more to do for his country."
54,tt0348214,Luen oi hang sing,Movie,Dante Lam,Kin Chung Chan,1h 51min,6.1,"Fung is a delivery boy who has several chance encounters with Jane. A budding relationship between the two is rapidly established, but when Jane is suddenly killed in a car accident, it seems as if it is all over. But Jane's dying wish, to see the dance competition she would have been in, comes true as she is given seven days to ""live"" within Fung's body. But when she... Leer todo"
55,tt1291119,Daikessen! Chô urutora 8 kyôdai,Movie,Takeshi Yagi,Keiichi Hasegawa,1h 37min,6.5,"Ultraman Moebius is joined once again by Ultraman, Ultra Seven, Ultraman Jack, and Ultraman Ace, as well as three later Ultramen (Tiga, Dyna, and Gaia) to fight more powerful versions of familiar Ultra Monsters."
56,tt0228430,El infierno prometido,Movie,Chumilla-Carbajosa,Chumilla-Carbajosa Edi Liccioli,2h 7min,6.7,"In a southern Mediterranean land, a modern Orpheus embarks on an initiatory journey through Los Infiernos (The Hell) between a devastating drought and a flood in search of water and the love of an enigmatic woman."
57,tt0452681,The Santa Clause 3: The Escape Clause,Movie,Michael Lembeck,Ed Decter John J. Strauss Leo Benvenuti,1h 37min,4.8,"Santa, alias Scott Calvin, se enfrenta a una doble tarea: cómo mantener a su nueva familia feliz y cómo evitar que Jack Frost se haga cargo de la Navidad."
58,tt0162301,The Effects of Magic,Movie,Charlie Martinez Chuck Martinez,Lee Cohen Belinda Wells,1h 27min,5.5,"A magician, aided by his talking magic bunny, joins forces with his previously estranged magician father, and together they fight the forces of evil to protect the art of magic."
59,tt2012626,Cheon-gook-eui woo-pyeon-bae-dal-boo,Movie,Lee Hyeong-min,Eriko Kitagawa,1h 47min,6.6,"Jaejoon, isn't your ordinary postman, he delivers letters to Heaven from those missing their loved ones."
60,tt4504044,The Prodigy,Movie,Nicholas Mc Carthy,Jeff Buhler,1h 32min,5.9,Una madre preocupada por el comportamiento perturbador de su hijo pequeño piensa que algo sobrenatural puede estar afectándolo.
61,tt14534872,Lori and the Six Six Sixties,Movie,Grant Mc Phee,Grant Mc Phee Ben Soper Lori Stott,No especificado,No especificado,
62,tt0944240,Tsukigami,Movie,Yasuo Furuhata,Jirô Asada Toshimi Kokubo,1h 47min,6.1,"An unfortunate low-ranking samurai Hikoshiro decides to pray in a small shrine and ask gods for help. Unfortunately he accidentally attracts the attention of gods of poverty, pestilence and death."
63,tt0343857,"Jeannie, bakit ngayon ka lang?",Movie,Ike Jarlego Jr.,Dennis Garcia,1h 43min,7.4,No especificado
64,tt4104280,Eos,Movie,Luis Cage,Luis Cage,No especificado,No especificado,No especificado
65,tt5161204,Diary of a Fatman,Movie,Steve Ravic,Steven Haar Steve Ravic,1h 35min,3.4,Meet Berd 'The Nerd' in a story of a man with no story to tell - until he falls asleep that is.
66,tt1899132,Blur,Movie,Gabriel R. Asoka,Gabriel R. Asoka,50min,No especificado,No especificado
67,tt0469640,Bathory,Movie,Juraj Jakubisko,Juraj Jakubisko John Paul Chapple Lubomír Feldek,2h 21min,5.7,"Con una sed insaciable de sangre, la condesa Elizabeth Bathory fue una de las asesinas en serie más prolíficas de la historia."
68,tt0119703,Mordbüro,Movie,Lionel Kopp,Lionel Kopp Patrick Lambert,1h 40min,4.4,"In a small bourgeois town, the Mordburo has been set to right people's wrong. But a generous idea may lead to dire consequences."
69,tt0435286,Gekijouban Poketto monsutâ Adobansu jenerêshon: Rekkuu no houmonsha Deokishisu,Movie,Kunihiko Yuyama Darren Dunstan,James Carter Cathcart Kathy Pilon Hideki Sonoda,1h 38min,6.0,"A comet bearing a deadly Pokemon creature crash-lands onto Earth, terrorising a nearby high-tech city, where Ash, Pikachu and friends are currently visiting..."
70,tt0977203,Doctor Infierno,Movie,Paco Limón,Jorge Bódalo Ramiro García Bogliano Diego García,1h 24min,6.9,"Doc Hell, famous gynecologist, wants to control the entire world. His plan: to heal the humanity using a miraculous medicine, in exchange for its complete submission. But his goals will be compromised when an unexpected detail, García Nurse, seeks revenge. The killer sent to her annihilation has failed. Nurse, murderer, one neighbor's boyfriend, the building manager, ... Leer todo"
71,tt0239235,Anji,Movie,Kodi Ramakrishna,Satyanand,2h 28min,6.2,"Orphaned Arjun lives a poor lifestyle in an ashram along with his mentor, known simply as Guruji, and several other younger orphans in a forest region, Shivgiri which is accessible via railway station Buddhir Medi. One day while returning home, he comes to the assistance of Sapna, who has journeyed all the way from North America after hearing of the sudden death of he... Leer todo"
72,tt3885422,The Spine of Night,Movie,Philip Gelatt Morgan Galen King,Philip Gelatt Morgan Galen King,1h 33min,6.4,La fantasía épica y ultravioleta ambientada en una tierra de magia sigue a héroes de diferentes épocas y culturas que luchan contra una fuerza malévola.
73,tt3056704,Habibi bistanan and al bahar,Movie,Mais Darwazah,Mais Darwazah,1h 20min,7.6,"A woman takes a first time journey back to her Palestine. Accompanied by Hasan, her imaginary lover, she searches for his fantasy world and finds the remnants of hope in a land exhausted by endless year"
74,tt8657636,Trip,Movie,Geoffrey Cochard Lesly Lynch,Lesly Lynch,50min,No especificado,"Karim wanders in a neighborhood of Paris suburbs. Attracted by techno music, he enters a warehouse where he discovers the existence of an unsuspected world - people inhabited by the same fury of life including Agata, Luc and Phil. We discover this three emblematic figures of the underground scene that speak to us of the courage to be faithful to who you want to be and... Leer todo"
75,tt2073154,Quest for Zhu,Movie,Bob Doucette,Sean Catherine Derek,1h 12min,4.4,"The heartwarming tale of four lively Hamsters on a quest to find the Palace of Zhu, where they believe all their dreams will come true. They soon find themselves swept away to the other side of the Zhuniverse."
76,tt1352725,Kiss of the Moon,Movie,Simon Lewis,Simon Lewis,45min,4.0,A vampire rediscovers her humanity when a young couple fall out during a night on the town.
77,tt5216534,Digimon Adventure tri. 2: Ketsui,Movie,Keitarô Motonaga,Akiyoshi Hongo Yûko Kakihara,1h 24min,7.1,"The DigiDestined have a good time in a theme park without Joe because he wants to study for his exams, while another infected Digimon, Ogremon, attacks Odaiba. Would Joe accept his responsibilities as a DigiDestined before it's too late?"
78,tt0366282,Candy Von Dewd and the Girls from Latexploitia,Movie,Jacques Boyreau,Jacques Boyreau,55min,3.8,"In the future, mankind is on the verge of extinction because of various biological mishaps. An expedition is sent to outer space to look for a planet with life forms that are ""seedable"". The ship lands on a planet that turns out to be populated by hot chicks in latex, who capture the crew. Complications ensue."
79,tt7146054,Da Hu Fa,Movie,Zhigang Yang,Zhigang Yang,1h 33min,7.1,"A warrior named Da Hufa goes to save his prince from a dystopian village. He finds the dystopian village ruled by a fake God and his guards. In order to save the prince, Da hufa has to defeat the God and his men and discloses the whole conspiracy."
80,tt17077058,Homestay,Movie,Natsuki Seta,Abhichoke Chandrasen Eto Mori Eakasit Thairaat,1h 52min,6.2,"A soul, homestays in the body of a deceased high school student. While reincarnated, it must find the student's death cause. Limited to 100 days, a glimmer of light and large darkness intersect in the truth."
81,tt8098546,Doraemon Nobita no Takarajima,Movie,Kazuaki Imai,Sung-bo Shim Genki Kawamura Fujio F. Fujiko,1h 48min,6.6,"Upon hearing about the story of Treasure Island, Nobita dreams of discovering and exploring his own treasure island, despite the fact all of the Earth has been mapped already."
82,tt8312728,Arion Among the Waves,Movie,Emmanuel Buriez,Emmanuel Buriez,No especificado,No especificado,"Arion is a poet singer who can bring the peace with his voice. The king of Corynthe organize a singing Olympiad for check the legendary abilities of the Arion's voice and meet him. But Arion will never arrive to the destination, meanwhile he was thrown to the sea."
83,tt20256806,Reverse,Movie,Scott Shaw,No especificado,No especificado,No especificado,
84,tt10181246,"Hello, My Cat",Movie,Hye-Jin Shin Woon Suk Bok,No especificado,1h 38min,6.2,The Omnibus movie is composed of 4 episodes about human beings and cats.
85,tt2331616,Zug der Abenteuer,Movie,Yvo René Scharf,Yvo René Scharf,No especificado,No especificado,No especificado
86,tt0114730,Der Trip,Movie,Wolfgang Büld,Wolfgang Büld Hans Weth Arne Elsholtz,1h 30min,4.0,"Dieter dreams of the great career as a pop singer. His parents, both sworn relics of the hippie era, are worrying, because Dieter doesn't want to get to know any girls. So they push him to go to discotecs. There he meets Petra, who is already engaged to the heir of millions, Hilmar. But the power of their feelings is stronger and beams the couple back to the year 197... Leer todo"
87,tt1571234,Mortal Engines,Movie,Christian Rivers,Fran Walsh Philippa Boyens Peter Jackson,2h 8min,6.1,"Una misteriosa joven llamada Hester Shaw une sus fuerzas a las de Anna Fang, una peligrosa forajida con una recompensa en mente, y Tom Natsworthy, un paria de Londres, para liderar la lucha contra una gigante ciudad depredadora sobre ruedas."
88,tt4468740,Paddington 2,Movie,Paul King,Paul King Simon Farnaby Michael Bond,1h 43min,7.8,"Paddington está felizmente asentado con la familia Brown y es un popular miembro de la comunidad local. Hace varios trabajos para poder comprarle el regalo perfecto a su tía Lucy para su 100 cumpleaños, pero alguien lo roba."
89,tt26544647,As He Was Written,Movie,Desmond Elliot,Qwekumalhi Ikenna Onyekwena,No especificado,No especificado,A lady receives a book that takes her to a world of enchantment where she discovers many ways to construct the man of her dreams.
90,tt7974634,Coati,Movie,Rodrigo Perez-Castro,Ligiah Villalobos Alan Resnick Rodrigo Perez-Castro,1h 32min,5.2,"Three unlikely heroes - Nachi, a free-spirited coati; Xochi, a fearless monarch butterfly and Pako, a hyperactive glass frog - embark on an adventure to stop wicked coral snake Zaina from destroying their rain forest homeland."
91,tt2602710,Zombie Apocalypse: A Love Story,Movie,Wendell Charles Ne Smith,Wendell Charles Ne Smith,No especificado,No especificado,"In a world full of rotting flesh, the only immune survivor spends his life searching for a cure to this epidemic."
