,0,1,2,3,4,5,6,7
397,tt0118638,Ariane ou l'âge d'or,Movie,Bernard Dartigues,Philippe Caubère,3h 10min,7.9,No especificado
398,tt0940828,Mentiras piadosas,Movie,Diego Sabanés,Diego Sabanés Julio Cortázar,1h 40min,6.8,"The story of an Argentine family entangled in a web of lies, all of which relate to the fabricated adventures of a lost son who sends gifts from foreign lands. What begins as a liberating game becomes a trap from which none in the family can escape."
399,tt5211742,Boku no tsuma to kekkon shitekudasai.,Movie,Yoshishige Miyake,Takuji Higuchi Arisa Kaneko,1h 53min,5.7,Shuji Mimura works as a broadcast writer. He learns that he doesn't have much time left to live. He decides to concentrate on the future of his beloved family. Shuji Mimura's final plan is to find the best man to marry his wife Ayako.
400,tt3903910,Animate Your Dead Date,Movie,Jennifer Jean Johnson Adonis Weir,Jennifer Jean Johnson Adonis Weir,47min,No especificado,No especificado
401,tt13288972,Pets 2,Movie,Neo Hallway,BC Fourteen,1h 5min,5.2,"Best buddies, Bella the laid-back cat, Bagel the goofy dog, and Alvin the opinionated parrot are hanging out on their cherished couch watching the best show on TV, Pets. Bella is particularly excited because today's episode of Pets is all about the coolest and most mysterious pet around: the cat. Join these three cushion-loving pals for yet another afternoon to rememb... Leer todo"
402,tt27747181,Sia Zangi,Movie,Ebrahim Ebrahimian,Soolmaz Aghmaghani Heshmatollah Aramideh Leila Bolukat,No especificado,No especificado,
403,tt0338959,Ek Se Badhkar Ek,Movie,Kundan Shah,Dilip Shukla,2h 26min,4.6,"Advocate Anand Mathur draws up a will for his client, while reading the novel ""Godfather"", and erroneously makes out the will with a provision that the beneficiary must be a criminal don in order to inherit the billions of rupees. The beneficiary is a bachelor named Rahul Bhargav, who wants no part of being a Don, criminal or anything of that sort. His Police Inspecto... Leer todo"
404,tt0208948,Feeling Sexy,Movie,Davida Allen,Davida Allen,50min,6.1,"Feeling Sexy is a story about Vicki, a passionate and vivacious artist with a voracious appetite for life and love. When she meets and marries medical student Greg, she feels she has found true happiness, but two kids and hours, weeks, years of house chores later soon shatter the dream. Vicki wants freedom, release and self-expression, and despite her love for Greg, f... Leer todo"
405,tt0353477,Ganamela,Movie,Ambili,Jagadish,No especificado,4.2,"When Venogopal falls in love with Lakshmi while performing at a women's college, his Ganamela troop members helps them get together, though there is opposition from Laksmi's family."
406,tt7788946,Roommates,Movie,A.V.S. Subramanyam,A.V.S. Subramanyam,2h 24min,5.7,Four youngsters get implicated in a murder case and escape from jail to prove their innocence.
407,tt1517073,Isang Araw Lang,Movie,Daniel Razon,Daniel Razon,1h 40min,8.4,The film is about a good jeepney driver and how he continues to inspire the people in his community to do good despite all the odds.
408,tt11737756,Golkeri,Movie,Kunal Jadhav Viral Shah,Karan Bhanushali Amatya Goradia Viral Shah,2h 8min,6.9,"Sahil and Harshita, overnight end their perfect relationship of two years. But, as much as they want to move on and move away from each other, they are stuck in awkward situations put up by their parents who make persistent attempts to bring them back together. Will their parents' concern cross the line and turn into interference? Or will they triumph in explaining th... Leer todo"
409,tt1613874,Potpourri,Movie,Elliot Diviney,Elliot Diviney,1h 30min,5.8,"A group of students at a liberal arts college in Minneapolis is faced with expulsion if their final papers in philosophy class are not satisfactory. As a result, the inept group of friends decides to experiment with a series of illicit drugs, in an effort to expand their cognitive horizons and help them better understand some of the mind-bending concepts of the course... Leer todo"
410,tt3513068,Twice Upon a Time in the West,Movie,Boris Despodov,Boris Despodov Andrey Paounov,1h 37min,5.6,"A girl on the run, a villain in the making, a faux cowboy, and Claudia Cardinale as Claudia Cardinale starring in a post-modern homage to cinema."
411,tt1549779,Embargo,Movie,António Ferreira,António Ferreira José Saramago Tiago Sousa,1h 20min,5.5,"Nuno is a man working at a hot dog stand, who also invented a machine which promises to revolutionize the shoe industry- a foot scanner. In the middle of a gasoline embargo and finding himself in a strange predicament, Nuno becomes mysteriously confined to his car, finding his life suddenly embargoed."
412,tt1657299,The Decoy Bride,Movie,Sheree Folkson,Neil Jaworski Sally Phillips,1h 29min,6.1,"Cuando los medios de comunicación del mundo descienden a la remota isla escocesa donde una actriz de Hollywood intenta casarse, una chica local es contratada como novia señuelo para disuadir a los paparazzi."
413,tt2507728,Cinema Company,Movie,Mamas,Mamas,2h 32min,5.5,"Cinema Company is a 2012 Malayalam romantic comedy drama film written and directed by Mamas, and starring mainly newcomers. Basil, Sanjeev, Shruthi Hariharan and Badri play the roles of four close friends who dream of making a film."
414,tt21209676,Macska a betonban,Movie,Ferenc Dalnoky,Ferenc Dalnoky,1h 36min,No especificado,
415,tt7816760,Rylo,Movie,Mike Garcia,Mike Garcia,1h 6min,No especificado,"Rylo Spencer's life is astray as she faces the uncertainty of entering her 30's; career, identity and dating all at the crossroads of her aspirations as a comedian."
416,tt6416098,Colores de Pasión,Movie,German Barreiro,German Barreiro Puma Rebelde,1h 13min,8.4,
417,tt0106984,Gadael Lenin,Movie,Endaf Emlyn,Sion Eirian Endaf Emlyn,1h 30min,7.7,"Seven teenagers and three teachers from a Welsh school visit Russia in a bid to rediscover themselves. On the overnight sleeper service to St Petersburg the students get separated from the teachers, which allows the students ample scope for rediscovery."
418,tt20881632,El Duro,Movie,Nacho Serapio,Alberto Hidalgo,No especificado,No especificado,"Un famoso escritor venido a menos, tiene una última oportunidad de sacar un best-seller y recuperar su vida, o hundirse en la miseria para siempre, para ello tendrá que asumir las consecuencias de su pasado y jugárselo todo a cara o cruz."
419,tt19369732,Our Date for Christmas,Movie,Chinneylove Eze,Chinneylove Eze Blessing Ire,1h 32min,No especificado,No especificado
420,tt4523666,Match Fixing,Movie,No especificado,No especificado,No especificado,No especificado,No especificado
421,tt11724402,The Last 24,Movie,Trick Trick,Aaron Matthew Atkisson Mikey Eckstein Martini Harris,No especificado,No especificado,No especificado
422,tt3696210,Peulraenmaen,Movie,Si-Heup Seong,Jung-a Lee Si-Heup Seong,1h 55min,7.0,"Jeong-seok es un bibliotecario obsesivo-compulsivo y debe hacer planes para todo. Incapaz de llevarse bien con los demás debido a esa personalidad, se enamora de una trabajadora de una tienda de conveniencia que se parece mucho a él."
423,tt2618500,Lügen und andere Wahrheiten,Movie,Vanessa Jopp,Stefan Schneider Vanessa Jopp,1h 46min,5.1,"Six intertwined people struggle with their own sincerity, and, in so doing, unravel their secrets and the lies they live."
424,tt1420539,Ek Se Bure Do,Movie,Tariq Khan,Nisar Akhtar Panchhi Jalonvi Bobby Khan,3h,4.2,"Two petty thieves face-off against gangsters, bandits and police after forging a treasure map."
425,tt0933061,Kvaska,Movie,Mirjam Landa,Mirjam Landa,1h 42min,5.3,"Young prisoner Micki (Filip Tomsa) escapes from prison so he can audition for a new musical, where the lead role is to be played by the queen of musicals Karin (Lucie Vondrácková), with whom he fell in love while behind bars. At the audition Micki is not chosen for the part; he also learns that Karin is dating the musical's main sponsor. A film about how love ferments... Leer todo"
426,tt0427086,Como Fazer Um Filme de Amor,Movie,José Roberto Torero,Luiz Moura José Roberto Torero,1h 30min,5.9,"Laura and Alan fall in love, but have to deal with the strange death of Alan's wife and with a rival, Lilith, who wants to break their relationship. At the same time, a narrator gives lessons on how to make a love story movie, exposing all clichés on that kind of film."
427,tt0113729,Mad Love,Movie,Antonia Bird,Paula Milne,1h 33min,5.3,La salvaje historia de dos jóvenes apasionados que emprenden un viaje para vivir la increíble aventura de sus vidas.
428,tt10045434,Kapi,Movie,Nihat Durak,Tolga Aydin Filiz Üstün Durak,1h 50min,6.9,"Yakup and Semsa are Syriac families living in Berlin with their three children and grandchildren. Twenty-five years ago they migrated from Mardin to Berlin. One day, a call comes from Mardin. This news is about Mikhael, whom they lost twenty-five years ago. Yakup and Semsa go to Mardin with their grandson, Nardin, who does not want to leave them alone."
429,tt1615917,Zombie Bankers,Movie,Drew Snyder,Brandhen Snyder Drew Snyder,1h 34min,6.8,A quirky black comedy that examines the predatory lending practices of the US banking system.
430,tt10096422,Watch Movie Free Online,Movie,Sergey A.,Sergey A.,45min,7.6,"El director de una tele local presenta nuevos proyectos de bajo coste a su cadena, pero estos parecen una completa locura."
431,tt0418471,Aris min geha amneya,Movie,Ali Idris Fadhel El-Garhi,Youssef Maaty,1h 30min,6.0,"A businessman who loves his daughter very much, refuses every man who proposes for her in order not to leave him. But can he refuse a man from a security entity?"
432,tt3130298,HARTs 5 - Geld ist nicht alles,Movie,Julian Tyrasa,Julian Tyrasa,1h 35min,6.0,Berlin 2013: Four men fight against turbo-capitalism. A tragicomedy about gentrification.
433,tt0109366,A Caixa,Movie,Manoel de Oliveira,Prista Monteiro Manoel de Oliveira,1h 33min,6.8,Stories of various individuals living in a poor district of Lisbon are intertwined with the sad life of a blind street vendor whose only means of support is his elm box.
434,tt2435516,Save the Gator Queen,Movie,Jeffery Lamb,Jeffery Lamb,1h 34min,No especificado,What a summer! Thirteen year old Kylee was not looking forward to spending time at her grandparent's house near the Ocala National Forest. After arriving she makes an unlikely friend and things change quickly. Now Justin and her are trying to outsmart kidnappers and save the quiet forest community from a developers bulldozer. An endangered flying frog that no one has ... Leer todo
435,tt0454619,Life by Default,Movie,Tony Daussat Kyle Wallace,Tony Daussat Kyle Wallace,1h 13min,8.2,"As two youths live through their humdrum routines; one night, things take a turn for the worse, and the two boys realize that the water they have been swimming in is about to get a lot deeper."
436,tt4653818,Demon Hole,Movie,Josh Crook,Josh Crook,1h 21min,3.5,"Un equipo de hidrofracturación perfora en tierras sagradas de los nativos americanos desatando un antiguo demonio. Sólo hay dos maneras de salir del bosque, sucumbir al demonio o morir."
437,tt0108186,Son in Law,Movie,Steve Rash,Patrick J. Clifton Susan Mc Martin Peter M. Lenkov,1h 35min,5.9,Un fiestero de la costa oeste se verá fuera de entorno cuando se enamore de una conservadora granjera del Medio oeste. Los dos mundos colisionarán cuando los dos estudiantes se enamoren.
438,tt16806990,Kongsi Raya,Movie,Teddy Chin,Teddy Chin,1h 42min,6.9,"An interracial relationship (Chinese bloke, Malay gal) encounter parental objections."
439,tt13099604,Laila Tip Top Chhaila Angutha Chhap (chhattisgarhi),Movie,Satish Jain,Satish Jain,No especificado,9.1,
440,tt7696006,Zane Badali,Movie,Mehrdad Mir Fallah,Peyman Abbasi,1h 44min,4.8,
441,tt0283017,Stregati dalla luna,Movie,Pino Ammendola Nicola Pistoia,Pino Ammendola,1h 31min,4.4,
442,tt4348012,Mayhem,Movie,Joe Lynch,Matias Caruso,1h 26min,6.4,Un virus se propaga a través de un complejo de oficinas provocando que los empleados exterioricen sus peores impulsos.
443,tt3772908,Busted City,Movie,Stefan Brun Paul L. Carr,Paul L. Carr,1h 22min,8.7,"Chicago, 1983 - will the city explode if a black mayor is elected? Busted City is a visceral portrayal of the intense racial politics surrounding the election of Harold Washington, Chicago's first black mayor. Theo is a bookie in a neighborhood tavern working with Jimbo, a retired Chicago cop. Al is their bag man and current Chicago cop. Johnny Jr. is Theo's brother, ... Leer todo"
444,tt7938498,Grande Punto,Movie,Vanja Hovan,Vanja Hovan Marko Kojic,1h 25min,4.6,"In a city owned by local television owner Dragan Zlokovic-Zli, books and culture are banned. The mysterious narrator - Senka, hires three private detectives to overthrow Zlokovic from the media."
445,tt3842618,Eigakan rakugo Kamometei dainidan,Movie,No especificado,No especificado,1h 21min,No especificado,No especificado
446,tt2165922,Modern Persuasion,Movie,Alex Appel Jonathan Lisecki,Jane Austen Jonathan Lisecki Barbara Radecki,1h 27min,4.9,Una mujer soltera se ve obligada a lidiar con las secuelas de una relación fallida cuando un exnovio contrata a su empresa.
447,tt1389070,Dancing on a Dry Salt Lake,Movie,Dominique De Fazio,Dominique De Fazio,2h 3min,8.0,"Warner De Santis, a cosmologist obsessed with trying to hear God back in time at the ""Origin of the Universe,"" gets fired from NASA, drives to the Mojave Desert, crashes his car, and remains in a small mining town until his car is fixed. There, Warner encounters persons that might be ""spirit messengers."" Taking their words as instructions, he goes on a mission to find... Leer todo"
448,tt8816194,Come to Daddy,Movie,Ant Timpson,Toby Harvard Ant Timpson,1h 36min,6.0,Un hombre de unos treinta años viaja a una cabaña remota para reconectarse con su padre.
449,tt1785498,On Parade,Movie,Edgar Muñiz,Seth Johansson Edgar Muñiz,1h 25min,No especificado,An honest look at the lives of three self-absorbed men as they complicate their love lives.
450,tt2370038,"Jian dan, Ai",Movie,Yan Cui,Yan Cui,1h 30min,6.3,"Ni Qiu is a lonely third grader. Shunned at school, fearful of ridicule, when the Annual Father's Career Day comes to her school, she tells a little white lie and claims that Fan Zi, an aging but still well-known rock star, is her father in order to gain acceptance from her peers. She presents a fake electronic photo of her hard-working single mom, Xiao Feng, an ex-da... Leer todo"
451,tt8661230,The (Other) One,Movie,Jay Leonard,Jay Leonard,No especificado,No especificado,"Hall of fame malcontent Sam Brighton is just a day away from proposing to his long time girl friend Beth, when a call from the past changes everything."
452,tt4308718,Summertime,Movie,Brandon Webster,Brandon Webster,1h 45min,8.5,"Amidst the silences of summertime, Dom, a passionate teenager ventures to explore and understand the experience of love, desire and satisfaction."
453,tt2520306,Glitch,Movie,Daniel Doherty II,Chelsea Rae Giegerich Matthew Giegerich,1h 33min,5.5,"An indie app developer struggles to navigate his friendship with a very taken girl, risking the loss of his best friend, business partner and career."
454,tt0492492,Stay,Movie,Bobcat Goldthwait,Bobcat Goldthwait,1h 27min,5.9,La vida de una mujer recién comprometida se vuelve un caos después de confesarle a su prometido que una vez experimentó con la bestialidad.
455,tt0211737,Von heute auf morgen,Movie,Danièle Huillet Jean-Marie Straub,Max Blonda,1h 2min,7.3,"It is late at night and a married couple has just returned home from a party, where they met a former school friend of the wife and a famous singer. The husband has been charmed by the seductive and elegant woman, and this makes him treat his wife, who has gone straight back to being a housewife, condescendingly. Talking about the evening, the husband praises the scho... Leer todo"
456,tt27828488,Biznes po-russki,Movie,Aleksandr Tsyrenov,Aleksandr Mangatkhanov,1h 16min,1.7,"There is a COVID-19 epidemic in the country, a lockdown is being introduced in the regions, people are being urged to get vaccinated on TV, against this background, a simple entrepreneur, the owner of a small business and his employees, are faced with the problem of restrictions and the lack of customers, which leads to a halt in activities. Different ways of maintain... Leer todo"
457,tt0762142,Les 3 p'tits cochons,Movie,Patrick Huard,Claude Lalonde Pierre Lamothe,2h 4min,6.9,"Two brothers (Legault, Lemay-Thivierge) discuss the positive and negative aspects of adultery as their mother lies beside them in a coma, while their brother Rémi (Doucet) attempts to discourage them. Their conversations become more explicit as time passes."
458,tt0421275,Strange as Angels,Movie,Steven Foley,Steven Foley,1h 39min,6.1,"Strange as Angels tells the story of Marilyn Ross, a beautiful painter in Chicago who decides to leave her mundane life behind and search for inner happiness until she meets Rodney Porter, a recently divorced journalist and the two begin an intense romance. Marilyn's is a story about the complicated notion of female independence in a post-feminist era; she feels the p... Leer todo"
459,tt6265124,Made in China napoletano,Movie,Simone Schettino,Giorgio Amato Simone Schettino,1h 37min,5.5,
460,tt15553778,Binders,Movie,Rebecca Lynne,Rachael Carnes,No especificado,No especificado,"When the apocalypse occurs with little warning, can three inexperienced people and a bunch of binders save the future of humanity? Betty, Barney, and Fred are the world's most inexperienced astronauts - and humanity's only hope. Will they be able to reach their destination and save the world?"
461,tt2583270,"Im Winter, so schön",Movie,Matthias Mettenbörger Daniel Rau,Piotr Kochalski Matthias Mettenbörger Daniel Rau,1h 20min,5.5,Strange things happen in a village.
462,tt1814621,Admission,Movie,Paul Weitz,Karen Croner Jean Hanff Korelitz,1h 48min,5.7,"Una oficial de admisiones de Princeton que espera una importante promoción asume un riesgo profesional después de conocer a un chico de educación alternativa, que podría ser el hijo que abandonó hace años en una adopción secreta."
463,tt4992086,Bhale Bhale Magadivoy,Movie,Maruthi Dasari,Maruthi Dasari Rishabh Purohit,2h 17min,7.7,An easily distracted scientist (Nani) goes to great lengths to make sure that his girlfriend (Lavanya Tripati) and her family members don't find out about his mental condition.
464,tt2561310,The Annual Vacay,Movie,James Bock,James Bock,1h 8min,No especificado,No especificado
465,tt0156807,Mr. Accident,Movie,Yahoo Serious,Yahoo Serious David Roach,1h 29min,4.3,A very clumsy man and his UFO-obsessed girlfriend discover a plan made by his boss to market eggs laced with nicotine.
466,tt1208731,Toinen jalka haudasta,Movie,Johanna Vuoksenmaa,Mika Ripatti Seppo Vesiluoma,1h 41min,5.6,A romantic comedy about a 35-year-old gardener Visa who learns he has only six months to live.
467,tt0104135,Double Trouble,Movie,John Paragon,Jeffrey Kerns Kurt Wimmer Charles Osburn,1h 26min,4.0,Muscle-bound twins try to smash a jewel smuggling ring.
468,tt0439046,Working Students,Movie,Ed Palmos,Lualhati Bautista Ed Palmos,No especificado,No especificado,
469,tt2317622,Crimes en sourdine,Movie,Joël Chalude Stéphane Onfroy,Joël Chalude,2h 1min,No especificado,
470,tt16222994,Merry Little Switchmas,Movie,La Vern Whitt,Anthony Guilianti Peggy Williams,1h 26min,5.4,"Aiden, far more intelligent kid than any 10-year-old boy should be, wishes that his newly-formed family of his sister, dad, stepmother, and stepbrother could all get along; the Kingsley household is anything but merry as the siblings constantly bicker. With the annual Christmas science fair approaching, Aiden attempts to create an experiment to help his family feel li... Leer todo"
471,tt0984057,Kim-gwanjang dae Kim-gwanjang dae Kim-gwanjang,Movie,Seong-gyun Park,Seong-gyun Park,1h 37min,6.1,"Three martial art master with the same surname, Kim. Compete with each other to win the beautiful girl heart, Yeon Sil."
472,tt0358676,Il ritorno di Cagliostro,Movie,Daniele CiprìFranco Maresco,Daniele CiprìFranco Maresco Lillo Iacolino,1h 40min,7.0,"In the Sicily of the late 1940s, two brother sculptors, tired of selling madonnas to the local churches, finally realize their dream, and set up a Sicilian production company, thanks to the help of a local bishop. They start producing one box-office failure Z-movie after the other, all with terribly bad local non-pros as actors. Covered in debts, they finally have the... Leer todo"
473,tt0782075,Randevú,Movie,Ágnes Incze,Ágnes Incze,1h 25min,4.9,"A terminally ill young woman Irén is saying good-bye to her child Rózsika. Fifty years later the then orphaned child is a homeless old woman who inherited her mother's pneumoconiosis. Throughout her time roaming around in the city Rózsika meets a taciturn woman, who moves in a strange way. They became close friends. Neither of them knows but the viewers soon find out ... Leer todo"
474,tt21874530,Maa Da Ladla,Movie,Uday Pratap Singh,Deep Jagdeep Jaedy,2h 20min,5.9,"The story revolves around Gora, Sehaj and Kevin. Gora is a struggling actor while Sehaj is a single mother who lives with her son Kevin. Sehaj hires Gora to play Kevin's father. Will everything go according to plan?"
475,tt0402151,El día de las locas,Movie,Eduardo Martínez,José Luis Cordero Diana Ferreti José Flores,1h 25min,No especificado,Charly Valentino is a madwoman. She has a sculptured and rounded body that is provocative and sensual.
476,tt7370570,Return of the Scarecrow,Movie,Walter Lodes III,Walter Lodes III,1h 14min,3.2,"A stupid Halloween prank goes awry, causing an evil, murderous scarecrow to reanimate and go on a killing spree."
477,tt12048234,Save the Cinema,Movie,Sara Sugarman,Piers Ashworth Lorraine King,1h 49min,6.5,"Liz Evans vive en Carmarthen South West Wales, donde decidió iniciar una campaña en los años 90 para salvar el Lyric Cinema."
478,tt0239953,Scrappers,Movie,Brent Beavers,Peter Kepler,No especificado,No especificado,No especificado
479,tt5711092,You Did This to Me,Movie,Matt Bardocz,Kira Soltanovich,57min,5.8,"Hormone crazed and pregnant Kira Soltanovich gets real with the trials and tribulations of pregnancy, birthing and raising kids. Putting her belly on the line, she hones in her maternal instincts in this hard-hitting, labor of love comedy special."
480,tt0462630,The Windy City Incident,Movie,Michael Haboush,Jason Ganwich Austen Hoogen Maurice Maxwell,1h 11min,2.6,"""It's a sad story of a drunk driving across the Mac."""
481,tt23897124,I pionieri,Movie,Luca Scivoletto,Eleonora Cimpanelli Pierpaolo Pirone Luca Scivoletto,1h 26min,6.8,"Sicily, summer 1990. Two young boys, sons of militant communists, run away from home to re-found the Pioneers, the glorious and now extinct scouts of the Italian Communist Party. But not everything goes according to their plans."
482,tt7957694,The Last Summer,Movie,William Bindley,Scott Bindley William Bindley,1h 49min,5.5,Un grupo de jóvenes en Chicago se reúnen para disfrutar de su último verano juntos antes de ir a la universidad.
483,tt1947983,Captive Audience,Movie,Mel Thompson,Mel Thompson,1h 33min,No especificado,A desperate author holds a restaurant and its patrons captive in order to share his latest masterpiece. All of which leads to a series of events that will impact the lives of several individuals.
484,tt0392908,When Do We Eat?,Movie,Salvador Litvak,Nina Davidovich Salvador Litvak,1h 26min,5.8,A family's Passover gets screwy after the patriarch unknowingly ingests a hit of Ecstasy.
485,tt11006570,La pièce rapportée,Movie,Antonin Peretjatko,Antonin Peretjatko Noëlle Renaude,1h 26min,5.5,"Paul Château Têtard, 48, falls in love with a young woman working as a counter clerk in the subway. When he plans to marry her, his mother launches a private detective on her tracks to prove that she's cheating on her son."
486,tt1610481,Halloween on 6th Street,Movie,Chris Blankenship Michelle Canning,Jared Ficklin Joseph Fotinos Jim Franklin,1h 25min,5.6,"All dressed up, one place to go. Austin enthusiasts rise to the creative challenge and do it for the craft, the tradition, the love of Halloween."
487,tt1700756,Casting,Movie,Jonathan Stemmler,Gianni Jordi,1h 30min,No especificado,No especificado
488,tt4917618,Kaanchaana,Movie,Srinivasan Ganesh,Sri Ganesh Tabla Nani,No especificado,6.9,"Three reality show hosts get into financial trouble with a local dangerous money launderer. To solve their money problem, they plot to rob a bank."
489,tt1575500,Aaduthu Paaduthu,Movie,Devi Prasad,Ramana Chintapally,2h 30min,7.2,"A man is living out of the bus left as inheritance by his dad and trying to make money to pay off debt. In this time he meets a village girl who they let live with them, but she has a backstory."
490,tt1322323,Iago,Movie,Volfango De Biasi,Volfango De Biasi Felice Di Basilio Tiziana Martini,1h 41min,4.1,
491,tt1605723,Glückliche Tage VII - Die Rolle ihres Lebens,Movie,Jörn Precht,Sarah Augstein Jörn Precht Frank Weiss,2h 14min,No especificado,
492,tt3650182,I Gotta Be Better Than Keanu,Movie,Stephen J. Bridgewater Alexandra Edwards Kris Frost,No especificado,1h 20min,No especificado,No especificado
493,tt0099272,City Hunter: Bay City Wars,Movie,Kenji Kodama,Tsukasa HôjôYasushi Hirano,45min,6.9,"Rival private eyes Ryo Saeba and Umibozu must find a way into a high-tech luxury hotel to rescue their friends who are being held hostage and stop a mad South American dictator's plans to use the hotel's supercomputer to unleash a nuclear holocaust. Highly reminiscent of Die Hard, right down to a scene where Ryu bunjee-jumps off of the roof of the hotel skyscraper wit... Leer todo"
