0,1,2,3,4,5,6,7
tt1724970,Beyond Skyline,Movie,Liam O'Donnell,Liam O'Donnell Joshua Cordes,1h 46min,5.3,Un duro detective se embarca en una persecución implacable para liberar a su hijo de una nave de guerra alienígena de pesadilla.
tt0483184,The Tiger,Movie,Shaji Kailas,B. Unnikrishnan,2h 32min,6.6,"The movie begins with the death of Varma (Murali) a senior government official who was about to on the verge of making a major anti-corruption bust. The case is handed over to Chandrashekharan IPS (Suresh Gopi) who goes by the nickname of ""The Tiger"". A turning point comes in the movie when a TV journalist Suhara (Gopika) disappears along with her Cameraman. Chandrash... Leer todo"
tt4701702,Lao pao er,Movie,Hu Guan,Runnian Dong Hu Guan,2h 14min,6.9,A well respected man residing in what's left of old-Beijing attempts to exonerate his son from his wrongdoings with his own methods and beliefs.
tt21482466,The Key of Baku,Movie,Zaur Tahirsoy,Zaur Tahirsoy,1h 30min,9.4,
tt7277674,Un-Speak-Able,Movie,Remy Fink,Remy Fink,No especificado,No especificado,
tt9507276,Saga of Tanya the Evil Movie,Movie,Yutaka Uemura,Carlo Zen Kenta Ihara Chika Tôjô,1h 55min,7.5,"Tanya Degurechaff continúa sus aventuras, evitando a la muerte y ser enviada al infierno, mientras lucha contra las fuerzas de Republic Army."
tt0423486,Violencia sin tregua,Movie,Gilberto de Anda,Ricardo Barona Kala Ruiz Juan Sahagun,1h 30min,No especificado,
tt6538906,Thong Dee Fun Khao,Movie,Bin Bunluerit,Buakaw Banchamek Sornsin Maneewan Manop Aswathep,2h 2min,5.5,"It follows the life of general Thongdee, growing up from a young hot-head to a legendary Muay Thai fighter. Based on a real story about a warrior ""White Teeth"" from Thailand's Ayutthaya period."
tt3390572,Haider,Movie,Vishal Bhardwaj,William Shakespeare Basharat Peer Vishal Bhardwaj,2h 40min,8.0,"Un joven regresa a Cachemira después de la desaparición de su padre para enfrentarse a su tío, de quien sospecha que desempeña un papel en el destino de su padre."
tt0478888,Shirley Pimple in the John Wayne Temple of Doom,Movie,Demetri Estdelacropolis,Marion Morrison,1h 30min,1.9,No especificado
tt12723616,BomBhaat,Movie,Raghavendra Varma Indukuri,K. Raghavendra Rao Akshay Poolla,2h 16min,4.5,A tale of twisted love with sparks of Sci-Fi and a deadly plot of vengeance. A young engineer battling his comedic misfortune gets entangled in an epic revenge story between his God Father and the Mad Scientist chasing a powerful formula
tt19881248,Oslacraft: the movie,Movie,Oscar Byrne,Oscar Byrne Freddie Potts,1h 16min,9.4,Oscar gets stuck in an alternate dimension in which the hacker was successful with his takeover from episode 16 and so he must defeat him along with alternate version of some familiar faces
tt18766736,Kamen Rider Saber: Trio of Deep Sin,Movie,Kazuya Kamihoriuchi,Takuro Fukuda,1h 12min,8.8,"Eight years after the battle for the Book of Omniscience, the peaceful lives of Touma, Rintaro, Mei and Kento are troubled by a mysterious new Falchion who can seemingly erase people from existence altogether."
tt6098734,Cannibal Corpse Killers,Movie,Joaquin Montalvan,Joaquin Montalvan Eunice Font S.E. Feinberg,1h 40min,4.4,"A legion of demons have been unleashed creating an apocalyptic America. Pike leads a group of survivors fighting demonically possessed corpses through the wasteland trying to make it to Jawbone, while The Magistrate is creating an army of cannibal corpses to serve him. What will be required of Pike to defeat this legion? It all started in Jawbone and it will all end i... Leer todo"
tt22767242,El Mochomo,Movie,Oscar Lopez,Oscar Lopez,No especificado,No especificado,
tt3456970,Malaikottai,Movie,Boopathy Pandian,Boopathy Pandian,2h 24min,5.1,Anbu gets into a fracas with a local politician and his comic henchmen while trying to save a friend and is arrested.
tt8706670,Rogue Deuce: A ShPoon Drugg Story,Movie,Jon English,Ethan Brant Jon English Leo Wells,No especificado,No especificado,
tt3079568,Minutes to Midnight,Movie,Christopher Ray,Victoria Dadi Christopher M. Don,1h 31min,3.6,"En la víspera de Año Nuevo, siete amigos y un misterioso mochilero convergen en un desolado albergue de esquí en las montañas cuando son sistemáticamente perseguidos por despiadados hombres enmascarados con una críptica agenda."
tt12943936,Sathyaraj in Emergency,Movie,Dheran,Dheran,No especificado,No especificado,
tt29280979,Xin feng shen zhi Er Lang Shen,Movie,Zhihong Chen,Ray Zhang Shi Xue Jing Haiming Leng,1h 10min,No especificado,No especificado
tt28769650,The Girl of Destiny,Movie,Dong Wei,Dong Wei,1h 25min,No especificado,No especificado
tt0315735,4 balgarak,Movie,Yun-shik Gye,Joon-ho Huh Chang-hun Lee Jun Gyu Park,No especificado,4.3,The story involves four friends who become gangsters. As the film progresses they gain power and eventually find their way to Seoul.
tt6581528,Sathya,Movie,Deepan,A.K. Sajan,1h 58min,2.6,"The protagonist from Kerala who goes to Pondicherry and becomes very successful in life by gambling. However, he also makes enemies because of this. The story further progresses through the various incidents that happen due to gambling."
tt10749934,The Woodsman,Movie,No especificado,No especificado,No especificado,No especificado,Three friends go into Blackwood Forest to find a missing childhood friend. But instead they are faced with nothing but carnage.
tt10594792,Mafia,Movie,Karthick Naren,Karthick Naren,1h 53min,5.9,A narcotics officer engages in a cat-and-mouse chase to capture a powerful criminal kingpin not knowing that it could have a connection to the truth in his past.
tt0813540,Naksha,Movie,Sachin Bajaj,Milap Zaveri Tushar Hiranandani,2h 8min,3.5,"An archaeologist loses life to protect a map from a rival. In the journey to unlock the mysteries of the map, his two sons overcome death-defying obstacles."
tt3160226,Tales of Albion,Movie,Gary Andrews,Gary Andrews Chris Tinniswood,2h 12min,7.1,"Myths, Legends and Folklore of Britain re-told in 8 tales woven together by a storyteller"
tt0417741,Harry Potter en de halfbloed prins,Movie,David Yates,Steve Kloves J.K. Rowling,2h 33min,7.6,"Cuando Harry Potter empieza su sexto año en Hogwarts, descubre un viejo libro marcado como propiedad del príncipe mestizo y comienza a aprender más sobre el oscuro pasado de Lord Voldemort."
tt4836336,Fyva,Movie,Aleksey Berdennikov,Aleksey Berdennikov,1h 3min,No especificado,"Life can change at any moment... All things that happen to us are not always our fault; sometimes we are just victims of cirumstance. Eveyrthing in one's life can change in one moment. The hero of the film goes and applys for a job, but accdientally ends up getting involved in criminal acitivity, including murder, car chases, and kidnapping. He became a pawn in a crim... Leer todo"
tt4865022,The Clinic,Movie,Darrell Wheat,Darrell Wheat,1h 30min,6.2,"When a woman wakes up unexpectedly from a coma after an experimental procedure, she must piece together her past while searching for her missing daughter in a sinister hospital that won't let her go."
tt11675352,Cochin Shadhi at Chennai 03,Movie,Manjith Divakar,Rijesh Bhaskar,2h 6min,5.6,
tt6754634,Mrittudando,Movie,A.J. Rana,Shabnam Parvin Wasimul Bari Rajib Rubel,No especificado,No especificado,No especificado
tt8803724,The Fearless Two,Movie,Jamal Hall,Vince Edgehill Alonzo Herran JRStruggle E. Stylez,1h 47min,8.6,"Cody and Kimberly are building a new life together. Samaad has revived the underground fights and wants Cody back to score a big payday, but a shadowy figure has sinister plans for all of them in this sequel to The Fearless One (2017)."
tt12110778,Finding the Balance,Movie,Jean Machado John Machado,Jean Machado John Machado,No especificado,No especificado,After getting in trouble with some thugs on the street Billy decides to turn things around by learning how to fight from a mysterious Master. With this new found power he solves one problem but creates another and now he must find the balance.
tt12433486,El Juego Final,Movie,Javier Castro,Javier Castro,No especificado,No especificado,No especificado
tt1567344,Into the Cold: A Journey of the Soul,Movie,Sebastian Copeland,Sebastian Copeland,1h 25min,6.8,"Into The Cold--A Journey of the Soul retraces the personal and harrowing expedition of two men on foot to the North Pole in sub-zero temperatures to commemorate the centennial of Admiral Peary's reach in 1909. It is a journey of endurance and commitment into the depth of the soul against the backdrop of the magnificent, unforgiving and rapidly vanishing Great North."
tt7028512,Path Jodi Na Sesh Hoi,Movie,Swapan Saha,Suchandra Chandra,2h 21min,No especificado,This movie is based on a love story. A girl named Titli meets with a car accident and she even loses her mother. Titli is severely injured on her head because of which she loses her memory of few years. She stays with her uncle and falls in love with a guy named Aranya. Titli suddenly gets back her memory and she forgets whatever happened after her accident. Aranya tr... Leer todo
tt4219130,Gekijouban Psycho-Pass,Movie,Naoyoshi Shiotani Katsuyuki Motohiro,Gen Urobuchi Joel Bergen Alex Muniz,1h 53min,7.1,"In this sequel to Psycho-Pass TV show, Inspector Tsunemori is sent to a neighboring war-torn nation, where the Sibyl System is being introduced as an experiment, to find Shinya Kogami, her former enforcer who went rogue three years ago."
tt8365306,Relentless,Movie,Steven Murphy,Steven Murphy,1h 13min,4.8,Un ex convicto liberado de la prisión acude en ayuda de una joven prostituta de una pandilla.
tt0207299,Airboss IV: The X Factor,Movie,J. Christian Ingvordsen,Matthew M. Howe J. Christian Ingvordsen,No especificado,4.1,AirBoss does cool stuff (Again)
tt19413836,Untitled City Hunter Film,Movie,Kazuyoshi Takeuchi Kenji Kodama,Tsukasa HôjôYasuyuki Muto Monkey Punch,1h 34min,6.2,Notorious gun-for-hire Ryo Saeba encounters a dark figure from his past.
tt5153276,Reach for the Sky,Movie,Ryan Cleek,Ryan Cleek,1h 14min,7.5,"Danger. Reward. Adrenaline. Freeride mountain biking is synonymous with pushing the known boundaries of the sport. Cam Zink sits atop the Freeride world having won its most coveted titles, the Red Bull Rampage, Crankworx Slopestyle, and the Freeride World Tour, yet those accolades have not come without a physical price. He has transcended cycling media, and his super-... Leer todo"
tt0104299,Freejack,Movie,Geoff Murphy,Robert Sheckley Steven Pressfield Ronald Shusett,1h 50min,5.4,"Los cazarrecompensas del futuro transportan a un piloto de carreras condenado a la ciudad de Nueva York en 2009, donde su mente será reemplazada por la de un multimillonario muerto."
tt0211443,Jason X,Movie,James Isaac,Todd Farmer Victor Miller,1h 32min,4.4,"Jason Voorhees regresa con una nueva apariencia, un nuevo machete y la misma actitud asesina cuando es despertado en una nave espacial del siglo XXV."
tt0393589,Persecución,Movie,César Alejandro,César Alejandro,1h 30min,No especificado,No especificado
tt12483500,The Emissaries Movie,Movie,Tiffinni Saint Ranae,Tiffinni Saint Ranae,1h 30min,No especificado,"A team of scientists hired by the government, are competing with a group of freelance scientists, researchers, and other groups, when one of them decides to recruit college students to help them calculate, and formulate various aspects of space travel, teleportation, and time travel. They almost start losing faith in things unseen, when two mavericks, one of them a gi... Leer todo"
tt13775060,LEGO SCP Foundation: Containment Lockdown,Movie,Starwarsstudio100,Starwarsstudio100,54min,8.0,A Test Subject and a questionable sidekick escape a dangerous laboratory in order to get to the free world.
tt0105681,Ultraviolet,Movie,Mark Griffiths,Gordon Cassidy Mark Griffiths,1h 20min,4.9,"A park ranger and his girlfriend run into a young man in the middle of Death Valley desert. He shoots the ranger, kidnaps the girl and starts playing psycho-sexual games with her. The wounded ranger gets a shotgun and goes after them."
tt0383543,Onmyoji 2,Movie,Yôjirô Takita,Itaru Era Yôjirô Takita Baku Yumemakura,1h 52min,6.0,A group of demons in the ancient Japanese capital of Heian is dismembering members of a family of Japanese nobles.
tt5463052,Persona 3 the Movie: #4 Winter of Rebirth,Movie,Tomohisa Taguchi,Jun Kumagai,1h 45min,7.1,The season changes to winter. Makoto makes a decision in order to greet the spring that is waiting beyond.
tt0382984,El soplo de la muerte,Movie,Enrique Murillo,Carlos Valdemar,1h 30min,No especificado,
tt4944418,Man On Mission Jaanbaaz,Movie,Mohan Babu Raghu Babu,No especificado,2h 5min,6.6,"After Sandhya is attacked by the men of Bhikshapati, a landlord, her boyfriend Sree rescues her and learns that his father has a history with him."
tt28228231,Priyotoma,Movie,Himel Ashraf,Himel Ashraf,2h 35min,5.6,"Una trágica historia de amor que dejó una marca indeleble en la vida de Sumon, destruyendo su mundo y dejándolo transformado para siempre."
tt0494867,Terrorist Hunter,Movie,Val Iglesias,Jorge Isaac,No especificado,No especificado,No especificado
tt14694114,9 Stacks,Movie,Steve Horn,Steve Horn,1h 47min,4.7,A young man finds himself caught up in a matter of business fraud and has to choose whether to call it out or try to escape the consequences.
tt2981784,Nidaime wa New Half,Movie,Hitoshi Ozawa,Hitoshi Ozawa,1h 26min,No especificado,
tt2175947,The Cure,Movie,David Gould,David Gould,1h 30min,3.5,The film is about a young female researcher whose life is in danger when she discovers the pharmaceutical company she works for had developed a cure for cancer many years earlier. They haven't released it because that would destroy their chemotherapy drug sales. She must now escape and release the cure to world while the company tries to stop her.
tt7990512,Cyborg Invasion,Movie,Mark Morris,Mark Morris,1h 2min,4.2,Cyborgs from our future try to change the past. Matt Preston investigates.
tt15655068,SV Werder Bremen vs VfL Wolfsburg,Movie,Kevin De Bruyne,No especificado,No especificado,No especificado,No especificado
tt13277046,Der Reisende,Movie,Meto Ege,Meto Ege,1h 10min,6.8,The fighter Kwan searches in south for a magician of the earth to assert against the murderer of Chiu Yen.
tt10954600,Ant-Man and the Wasp: Quantumania,Movie,Peyton Reed,Jeff Loveness Stan Lee Larry Lieber,2h 4min,6.1,"Adentrándose en el Reino Cuántico, Scott Lang y Hope Van Dyne junto con sus padres y la hija de Scott interactúan con extrañas criaturas cuando se encuentran con Kang, un misterioso viajero que les hace una oferta tentadora."
tt1966496,Kedi,Movie,Jyothi Krishna,A.M. Jyoti Krishna,2h 52min,3.5,A happy-go-lucky student at a university gets embroiled in a love triangle with two very different young women.
tt23387272,Lock Your Safety Pin,Movie,Dondi Schwartz,No especificado,No especificado,No especificado,
tt0288305,Kôshoku kunoichi ninpô-chô: Vâjin sunaipâ - bishôjo yôma-den,Movie,Mototsugu Watanabe,Takao Nakano Mototsugu Watanabe,1h 19min,6.0,"Toranaga is a good-for-nothing loser but happens to be the last remaining descendant of the Shogun. When a mysterious ninja threatens Toranaga's life, the great ninja Hattori Hanzo is hired to protect him. Hanzo must fight against the leader of the ninjas, Neneko, who bears a centuries-old grudge. Will the Shogun's line come to an end? A light-hearted present-day off ... Leer todo"
tt0202669,Vykup,Movie,Vladimir Balkashinov,Yuriy Rogoza,1h 30min,6.2,"Srul Solomonovich Sudaker - ""conductor of the symphony orchestra"" - a conman who lives not only on retirement. And Eugene really needs money. To redeem his only friend from captivity, he decides to use the abilities of the ""conductor""."
tt0119815,"O Que é Isso, Companheiro?",Movie,Bruno Barreto,Fernando Gabeira Leopoldo Serran,1h 50min,7.4,"Guerrilleros urbanos brasileños secuestran al embajador estadounidense. Ahora, la vida del diplomático pende de un hilo, atrapado sin poder hacer nada entre un gobierno que no está dispuesto a cooperar, y su miedo a los propios captores."
tt0103745,92 Ba wang hua yu Ba wang hua,Movie,Wellson Chin,Abe Kwong Chun-Wai Lau,1h 33min,5.3,"To save the Hong Kong Police Force's Banshee Squad from becoming defunct, the struggling new squad members seek the help of former officers Amy (Sandra Ng Kwan Yue), now a divorced mom with a young kid, and May (Kara Hui), now partially mentally-unstable, to help them with their training regiment, lead by Madame Yang (Cynthia Khan). Their police skills are put to the ... Leer todo"
tt22477142,Remember,Movie,No especificado,No especificado,No especificado,No especificado,No especificado
tt21065316,Jurassic Domination,Movie,Brian Nowak,Geoff Meed Jason Tozier,1h 25min,2.6,"When two military-made, weaponized dinosaurs attack a small mountain town, it's up to the sheriff to figure out a way to stop the creatures before the dinos escape and wreak havoc nationwide."
tt0461576,Secuestro,Movie,Gonzalo Lira,Gonzalo Lira Julio Rojas Paula del Fierro,1h 34min,5.2,"A 22-year-old girl, the daughter of a millionaire businessman, is the victim of an express kidnapping, from which she will only be saved if her father pays a large ransom."
tt0410952,Charas: A Joint Effort,Movie,Tigmanshu Dhulia,Jimmy Shergill Uday Chopra Irrfan Khan,2h 20min,5.3,"A police officer gets embroiled in a deadly game with drug mafia, while searching for his long lost friend from London."
tt2914898,Gooli,Movie,P.N. Sathya,P.N. Sathya,2h 18min,5.2,"Gooli is a Kannada action film, directed by P. Sathya, released in 2008. It stars Sudeep, Mamta Mohandas in lead roles.The central character Ghooli (Sudeep) is an uneducated, rude youngster and deadly merciless cruel rowdy with whom a girl named Ramya (Mamta) accidentally falls in love by seeing his pure and unadulterated heart. Ramya continues to keep in touch with G... Leer todo"
tt1042879,Curse of the Pink Panties,Movie,Kirk Bowman,Kirk Bowman,1h 18min,3.6,"Sexy young starlets perform in on-line videos for a Lingerie Designer's contest. Several do scarf juggling in panties, while another team does a gangster-themed video with pastel-colored squirt guns. A feisty girl - ASHLEY performs a black magic ceremony with her friends on camera, but, at that very moment, a gun fight breaks out downtown during a botched jewel transa... Leer todo"
tt13634290,The mazzata show,Movie,Innovazione Due,Paolo Riva Daniele Giulietti Stefano Galli,No especificado,No especificado,No especificado
tt15502246,Captain of Desert,Movie,Antonio Hernández,Sergio Peris-Mencheta Natasha Yarovenko,No especificado,9.1,No especificado
tt2177751,The Devil Girl of Devonshire,Movie,Sean Tyler,Sean Tyler,No especificado,No especificado,No especificado
tt8016262,Bharjari,Movie,Chethan Kumar,Chethan Kumar,2h 37min,5.0,"Romantic action drama about the life of an easygoing youngster named Surya, whose life take some unexpected turns thanks to the three women he meets along the way."
tt5074124,Tatlong anak isang ama,Movie,Deo Fajardo Jr.,Jun L. Ching Deo Fajardo Jr.,No especificado,No especificado,No especificado
tt0407828,Gobernador,Movie,Romy Suzara,Tony Pascua Agustin dela Cruz,1h 44min,No especificado,No especificado
tt2232428,Sadda Haq,Movie,Mandeep Benipal,Kuljinder Singh Sidhu,2h 13min,7.5,"Canadian Student Sharon Gill comes to India for her research on the topic ""why minority was at war in Punjab""? During her journey she meets a former militant Kartar Singh Baaz who is in jail. Bass informs her that he was very good hockey player and his only dream was to play for India, but prevailing circumstances forced him and many other Sikh youngsters like him to ... Leer todo"
tt2061646,Diamonds Aren't Forever,Movie,Frederick Tabiyus Nah IV,Frederick Tabiyus Nah IV,No especificado,6.6,"A group of International based workers from the United Nations enter Liberia to solve the diamonds scandal and to restore the beautiful country to what it was in the mist of the country civil disputes. Timing could have not been worse and everyone is not pleased that they have arrived. In the mist of lies, misfortune, poverty, & deception, two people from opposite end... Leer todo"
tt11942280,Hertha BSC vs Hamburger SV,Movie,No especificado,No especificado,1h 32min,No especificado,No especificado
tt10691908,Confound,Movie,Andrew Jacob Brown,Andrew Jacob Brown,1h 52min,7.2,"A 12 year old girl wakes up in a forest with amnesia and an arsenal of bible knowledge and martial arts skills. When she discovers that some mysterious men are after her, she must escape their clutches and unlock her memory to unveil a confounding truth."
tt17499172,The Gift,Movie,John Michael Hightower Jr.,John Michael Hightower Jr.,No especificado,No especificado,No especificado
tt0120383,"Truth or Consequences, N.M.",Movie,Kiefer Sutherland,Brad Mirman,1h 46min,6.3,"A group of crooks, an ex con, his friend and a gun crazy gangster plan a drug heist, but not everything goes as planned."
tt10815982,Officer Arjun Singh IPS,Movie,Arshad Siddiqui,Arshad Siddiqui,2h,6.7,"When a self-righteous police officer is transferred to Allahabad with a mission, he attempts to restore the dignity of the force, but ends up manipulating the law to seek justice."
tt11490170,Hit,Movie,Sailesh Kolanu,Sailesh Kolanu Surbhi Sehgal,2h 5min,7.6,"Vikram es un policía de treinta años. Mientras se enfrenta a su traumático pasado, intenta resolver la desaparición de una joven en Hyderabad."
tt0187750,Primary Suspect,Movie,Jeff Celentano,D. Alvelo Marc Bienstock Jeff Celentano,1h 31min,4.8,"On a personal mission to destroy his wife's killer, a Denver cop (William Baldwin) joins a rogue operation that goes bad and finds himself under suspicion of murder, yet still manages to restart his life."
tt2355559,Everyman,Movie,John M. Broadhead,John M. Broadhead Conor Hennelly,1h 59min,No especificado,"'Everyman' is the story of Detective Alex Dorman, tasked with bringing down powerful mob boss Eric Farron. A man of ideals, Dorman is unwilling to let anything stop him from fulfilling the letter of the law. But when he is faced with Marcus, a trained killer on the path towards redemption, the line between law and justice becomes blurred. Further complicating matters ... Leer todo"
tt4286330,Southtown,Movie,Kamen Casey,Kamen Casey,58min,No especificado,"Welcome to Southtown, a city built by hustlers and fueled by their money. Everyone in this town is a hustler, or thinks they are. Three classes of individuals in the town must find a way to survive the concrete jungle."
tt1663662,Pacific Rim,Movie,Guillermo del Toro,Travis Beacham Guillermo del Toro,2h 11min,6.9,"En plena guerra entre la humanidad y monstruosas criaturas marinas, un expiloto y una aprendiz se emparejan para manejar un arma especial, en apariencia obsoleta, en un esfuerzo desesperado por salvar al mundo del apocalipsis."
tt4983780,Maanaadu,Movie,Venkat Prabhu,Venkat Prabhu K. Chandru Ezhilarasu Gunasekaran,2h 27min,8.3,"El día de una conferencia pública del Ministro Principal del Estado, su guardaespaldas y un oficial de policía quedan atrapados en un bucle de tiempo."
tt9569104,Chapulin: El Hijo De La Leyenda,Movie,Pedro D. Flores,Pedro D. Flores Jean-Pierre Rueda,No especificado,No especificado,No especificado
tt0398113,Hum Hain Khalnayak,Movie,R. Thakur,Suroor Lucknowi,No especificado,5.6,"Widowed Havaldar Pandupatti would like to get his only child, a daughter named Madhuri, happily married, preferably to a Police Inspector. But Madhuri has eyes only for Bollywood super-stars like Sanjay Dutt, Shahrukh Khan, and Govinda, and all she wants is to be an actress so that she can be near any or all of them. She will not even consider marrying anyone else. Sh... Leer todo"
tt4978228,Baap ji,Movie,D. Rajendra Babu,D. Rajendra Babu Vijayendra Prasad,2h 16min,7.8,"Sakthi kills the DSP. Rekha, who witnesses her father's death lies to the police about Sakthi and saves him from getting arrested. What could be her true intentions by saving him? Watch the full movie Appaji online, only on Eros Now."
tt3648326,Fujiyama Ichiban,Movie,Michi Yamato,Mike Bedard Michi Yamato,No especificado,7.2,"Dark Matter, an alien organization, has been freed from captivity and comes to earth, and can only be stopped by Sun, who transforms into Fujiyama Ichiban, a hero that dons solar powered armor."
tt3036654,Fatal Instinct,Movie,Luciano Saber,Luciano Saber,1h 30min,4.4,A police detective follows a trail of evidence that eventually seems to lead to his trusted partner's ex-con brother who he helped put in prison years ago.
tt4272866,Bakemono no ko,Movie,Mamoru Hosoda,Mamoru Hosoda,1h 59min,7.6,"Cuando un joven huérfano que vive en las calles de Shibuya se topa con un fantástico mundo de bestias, es acogido por una bestia guerrera brusca que busca un aprendiz."
tt4353270,Echo Boomers,Movie,Seth Savoy,Kevin Bernhardt Jason Miller Seth Savoy,1h 34min,5.3,Cinco graduados universitarios deciden que la mejor manera de vengarse de la economía injusta y vivir la vida que siempre han querido es robarle a los más ricos de Chicago.
tt5937964,Black Code,Movie,Nicholas de Pencier,Ron Deibert Felipe Altenfeldor Wjd Dhnie,1h 30min,6.1,"A look at the global impact the internet has on free speech, privacy and activism."
tt1043635,Fast Track: No Limits,Movie,Axel Sand,Lee Goldberg,1h 40min,5.0,An action movie centered around a group of street racers.
tt2331073,Snake Club: Revenge of the Snake Woman,Movie,David Palmieri,Kenny White,No especificado,2.7,A stripper is possessed by an ancient snake goddess and wants to kill or recruit everyone at the club.
tt5095844,Alyas Totoy: Kamay Na Bakal Ng WPD,Movie,Pepe Marcos,Jestoni Alarcon Gretchen Barretto Dencio Padilla,No especificado,No especificado,No especificado
tt6410524,5,Movie,Victor Jones,William Beverly Karen Bramble Asia Brown,1h 40min,No especificado,No especificado
