0,1,2,3,4,5,6,7
tt1483815,Vidhyaarthi: The Power of Students,Movie,Rakesh Kakaria Chand Mehta,R.S. Pandit R.S. Sodhani,4h 10min,5.6,This story about underworld and crime. How can 5 small child student team fight with underworld and finished all criminals without any support and outside facilities. All student expert and having knowledge of computer and fight. This is only mind game fight between child and criminals.
tt0341639,Vishwasghaat,Movie,Himanshu Brahmbhatt,Suniel Shetty Anjali Jathar Anupam Kher,2h 8min,5.5,"Rammohan lives a poor lifestyle in India along with his grandson, Avinash, the only child of his late son, Indermohan. Rammohan is disappointed with Avinash as he always seems to be getting into trouble and fisticuffs. Quite unknown to him, Avinash makes a living by wrestling. Then one day Rammohan finds out that Avinash has got into a fight with a gangster named Yeda... Leer todo"
tt11778926,Tainted Getaway,Movie,Rizal Halim Desmond Hew Scott A. Summers,Desmond Hew Rocky Mangan Scott A. Summers,1h 27min,6.3,"What was meant to be a once-in-a-lifetime job opportunity for Allison Haven becomes a nightmare when she's abducted by escape convict Brock Bremmer, who vows to retrieve his lost money from a tragic past. Little does he know an old nemesis, Mason, is hot on his trail to retrieve it as well, including the authorities who will stop at nothing to bringing them to justice... Leer todo"
tt27216662,The Vanished Jade Seal,Movie,Jintao Zhang,Xu Liu Chen Song Eric Suen,No especificado,7.6,No especificado
tt21299364,Broadcast Dead,Movie,Samuel Leong,Josh Bult Billy Francisco Samuel Leong,1h 17min,4.3,A group of terrorists holed up inside a TV studio in Hong Kong must battle an army of undead monsters created by the deadly virus they released. Changing the channel won't help you when you're dead.
tt1692190,El infierno,Movie,Luis Estrada,Luis Estrada Jaime Sampietro,2h 29min,7.7,"Historia de Benjamin Garcia el Benny que al ser deportado a Mexico regresa a su pueblo controlado por la mafia, en donde trata de salir adelante junto a su familia"
tt4489798,Free Bullet,Movie,Caroline Detournay Paulina Pisarek,Caroline Detournay Paulina Pisarek,50min,No especificado,"Nioumoune Island, Senegal. Boniface, a young priest torn between his desires, escapes from his parish. The edge of his makeshift boat, it crosses a disturbing maze of mangroves. In search of freedom, he began a journey that will confront his past, his hidden desires and the vastness of the Mauritanian desert."
tt3697626,Ggeutggaji ganda,Movie,Seong Hun Kim,Lee Hae-jun Seong Hun Kim,1h 51min,7.2,"Después de intentar encubrir un accidente automovilístico que dejó a un hombre muerto, un detective de homicidios corrupto es acosado por un hombre misterioso que afirma haber presenciado el evento."
tt12398294,Someday Isles,Movie,Tsz Ying Lau Shawn St. Cyr,Shawn St. Cyr,1h 30min,4.1,"""Someday Isles"" is a Feature Film detailing the chaotic journey of PayAttenion coming to terms with his life's purpose by embracing his destiny through self-actualization. The film is set in multiple destinations, but scenes are concentrated primarily in Hong Kong and Los Angeles. The central focus and meanings of the film are self-reflection, self-determination, and ... Leer todo"
tt3418972,Toro Loco: Sangriento,Movie,Patricio Valladares,Andrea Cavaletto Patricio Valladares,1h 35min,5.5,"Toro Loco: Bloodthirsty stars Francisco Melo as a vigilante who enlists the support of a young beauty, her geeky brother and a trigger-happy drag queen to avenge the murder of his son."
tt4966118,Daag: The Burning Fire,Movie,Aarthi Agarwal Mahesh Babu,No especificado,No especificado,7.6,
tt22771218,Hismario123 Unites,Movie,Charlie Lyons-Morgan,Charlie Lyons-Morgan,1h 28min,No especificado,No especificado
tt2768084,Eiga Doraemon: Nobita to himitsu dougu myûjiamu,Movie,Yukiyo Teramoto,Fujio F. Fujiko Higashi Shimizu Ui Seok Cho,1h 40min,6.9,Doraemon y sus amigos buscan a un famoso ladrón después de que robó la campana de Doraemon.
tt14819826,The Cold Sector,Movie,Mikko Olive,Chase Havera Malakai Langbaur Christan Massy,No especificado,No especificado,No especificado
tt0758730,AVP2: Aliens vs. Predator 2 - Requiem,Movie,Colin Strause Greg Strause,Shane Salerno Dan O'Bannon Ronald Shusett,1h 34min,4.6,"La guerra entre Alíen y Predator llega a una pequeña ciudad de Colorado, y los residentes tendrán que unir fuerzas por una oportunidad de sobrevivir."
tt0214178,Sooryavansham,Movie,E.V.V. Satyanarayana Pranavanand,Vikraman Aadesh K. Arjun E.V.V. Satyanarayana,2h 48min,6.3,"Heera fails to live up to expectations of his father Thakur Bhanupratap Singh, a powerful and respected man of his community. Despite all odds Heera struggles to keep his father's pride."
tt1697826,The Box of Sergius,Movie,Joe Blodgett,Joe Blodgett Bryan Fleck Steve Fleck,1h 22min,No especificado,A man with the power to inspire or corrupt must choose a fate for a withering villain on a murderous rampage to reclaim what was once his.
tt5377624,Kingdom of Gladiators: The Tournament,Movie,Stefano Milla,Stefano Milla,1h 27min,4.4,"A Templar Knight is forced to fight as a gladiator where challengers from different worlds duel in a quest for a magical sword. Forced to fight his greedy master, he must team with his adversaries against the master and his disciples."
tt1325004,The Twilight Saga: Eclipse,Movie,David Slade,Melissa Rosenberg Stephenie Meyer,2h 4min,5.1,"Mientras una serie de asesinatos misteriosos tienen lugar en Seattle, Bella tiene que elegir entre su amor por el vampiro Edward y su amistad con el hombre lobo Jacob."
tt1552983,Boni,Movie,Pippalla Raj,Lakshmi Bhupala Pippalla Raj Rajasimha Tadinada,2h 28min,4.3,A small time crook falls for the woman that he's hired to kidnap.
tt1173901,El-Gazirah,Movie,Sharif Arafah,Sharif Arafah Mohamed Diab,1h 32min,7.8,"'El Gezira' is a film about a community of Upper Egypt residents living in El Gezira (the Island). They have their own set of rules, ethics and traditions. They also plant drugs and buy arms from Sudan. The officer in charge of the region turns a blind eye to these happenings, and in the beginning, the government takes no heed of the Island. At the start of the film, ... Leer todo"
tt3747512,Red Sky: Candidate 5238,Movie,Stewart Marshall,Stewart Marshall,2h 2min,5.8,"Chris, a prison officer is seeking justice to find Candidate 5238 ""Jericho"" an escaped prisoner who has gained powers beyond the typical super soldier, but with the R.O.N in the way, Chris is forced to fight back along side the resistance."
tt0178704,The Life Before This,Movie,Jerry Ciccoritti,Semi Chellas,1h 32min,6.1,"Several innocent bystanders are injured or killed when two robbers, fleeing from the police, run into the neighborhood cafe."
tt13572152,El Hijo del Presidente,Movie,Jackson Gutierrez,Luciano Muguerza Julio Alcázar Antonio Delli,No especificado,6.1,
tt1728632,Haq,Movie,Jumaatun Azmi C.L. Hor,Nur Hussein Brian Iskandar,1h 30min,5.7,"HAQ is an action-packed thriller that chronicles the lives of two ordinary brothers with extraordinary power, who must either overcome or succumb to their own demons when they finally confront each other."
tt0435026,Jing mo gaa ting,Movie,Stephen Fung,Stephen Fung Yiu Fai Lo,1h 42min,6.1,"A former secret agent's past catches up to him, and his two children have to rescue him before it's too late."
tt0102036,Highway to Hell,Movie,Bret Mc Cormick,Gary Kennamer,1h 30min,6.2,Escaped mass murderer goes on a rampage and is hunted by the cop who sent him up the first time.
tt0465234,National Treasure: Book of Secrets,Movie,Jon Turteltaub,Marianne Wibberley Cormac Wibberley Gregory Poirier,2h 4min,6.5,Benjamin Gates debe seguir una pista dejada en el diario de John Wilkes Booth para demostrar la inocencia de su antepasado en el asesinato de Abraham Lincoln.
tt2935888,Billy the Kid,Movie,Christopher Forbes,Graye Bumgardner,1h 20min,2.2,"A bounty hunter from New Mexico and a gang of horsemen called ""Four of the Apocalypse"" set their sights on the town of Dogma."
tt0347870,"Resbak, babalikan kita",Movie,Augusto Salvador,Humilde 'Meek' Roxas,No especificado,3.3,
tt0284671,Ying xiong di zhi: Xiao dao hui,Movie,Kin-sang Lee,Yin Nam,1h 36min,4.8,
tt4796634,Selfie 69,Movie,Cristina Jacob,Cristina Jacob Tudor Potra Maria Spirache,1h 56min,6.0,"Tras una fiesta, Roxi, Yasmine y Ana hacen una apuesta: la ganadora será la primera en casarse en los próximos tres días."
tt6251024,Office Uprising,Movie,Lin Oeding,Ian Shorr Peter Gamble,1h 32min,5.7,Un empleado de una fábrica de armas descubre que una bebida energética convierte a sus compañeros de trabajo en zombis.
tt0107948,Reportaje a la muerte,Movie,Danny Gavidia,Diego Bertie Marisol Palacios Carlos Cano de la Fuente,1h 35min,7.1,
tt4788602,Doraemon: Nobita and the Space Heroes,Movie,Yoshihiro Ôsugi,Fujio F. Fujiko Higashi Shimizu,1h 40min,6.5,"Nobita wishes to be a real hero. Doraemon uses his gadget, the Burger Director to make them a real movie superhero. Aron saw the five powers and abilities and asks them to help him save his planet, the planet Pokkuru. After their journey to the planet, the gang thought it was only Burger's doing but realizing that it is not a movie and they are actually fighting bad g... Leer todo"
tt0782154,Dòng máu anh hùng,Movie,Charlie Nguyen,Charlie Nguyen Johnny Tri Nguyen Dominic Pereira,1h 43min,6.8,"France employs local secret agents in Vietnam 1922 to eliminate resistance. The rebel leader's pretty daughter gets captured. Later an agent seems to have fallen in love with her and helps her escape. He flees, too. Lots of martial arts."
tt4024906,Katutura,Movie,Florian Schott,Obed Emvula Florian Schott,1h 54min,6.9,Katutura follows several characters experience the gravity of living in a Township where dreams are poised to die. As they remain hopeful in the face of adversity they are unaware their lives will collide in both hopeful and brutal ways.
tt3478232,Mythica: The Darkspore,Movie,Anne K. Black,Anne K. Black Jason Faller Kynan Griffin,1h 47min,5.2,"Marek and her company must go on a journey and prevent Szorlok from obtaining all the shards of the Darkspore, or all will be lost."
tt12982370,Rise of the Footsoldier: Origins,Movie,Nick Nevern,Andrew Loveday Nick Nevern,1h 47min,5.8,"La historia de cómo Tucker, Rolfie y Pat Tate se unen para formar su propia empresa."
tt0861686,Almost Related,Movie,Marcus Aurelius,Marcus Aurelius Steve Montoya Lonnie Schuyler,No especificado,7.8,"ALMOST RELATED Synopsis: Almost related is an action packed, erotic comedy thriller that profiles the obscure intricacies of ancestral Japanese assassins. Almost Related highlights a series of bizarre murders occurring in the pursuit to acquire the Kuji Denjo Scrolls. A legacy of an ancient civilization known as the Weirding Clan, set in the backdrop of erotic setting... Leer todo"
tt0280889,Maanthrikam,Movie,Thampi Kannanthanam,Babu Pallassery,2h 24min,6.3,A noted rocket scientist is kidnapped by terrorists. Two spys reach a small village in search of him.
tt4991652,Camino,Movie,Josh C. Waller,Daniel Noah Josh C. Waller,1h 43min,4.9,"In the jungles of Colombia, a photojournalist captures the truth behind a group of missionaries who may not be what they seem."
tt0776788,Mah-Aut,Movie,Krisorn Buramasing,Siam Thongbaiyai,1h 34min,4.4,
tt0108097,Sha ren zhe Tang Zhan,Movie,Siu-Hung Chung,Tan Cheung Roy Szeto Shui-on Wen,1h 18min,6.1,"A poor farmer who loves a woman he is forbidden to associate with becomes a hardened mercenary, and is hired by a local warlord as a professional assassin. Years later, he runs into his old love and begins to question his violent past."
tt12845920,Jitsuroku wakagashira,Movie,No especificado,No especificado,No especificado,No especificado,No especificado
tt1850363,Ertkhel Shua Qalaqshi,Movie,David Chabashvili Gocha Korkhelauri,Giorgi Janelidze Irakli Kalandadze Guja Macharashvili,1h 30min,6.3,"In luxury shopping center, the Qarvasla is exhibited an exclusive diamond from the Louvre. Georgia's hype sitcom - ""Shua Qalaqshi"" personages: Irakli, Marika, Dato, Glonti-sisters and others came there for shopping, gossip etc. At this moment, the world's most dangerous terrorists are planning to steal the Louvre's treasure. By very accident, Irakli Chkheidze together... Leer todo"
tt6015328,Chui lung,Movie,Jason Kwan Jing Wong Aman Chang,Koon-Nam Lui Jing Wong Ming-Ho Yip,2h 8min,6.7,"An illegal immigrant from Mainland China sneaks into corrupt British-colonized Hong Kong in 1963, transforming himself into a ruthless and emerging drug lord."
tt2953640,"Oro, dolor y muerte",Movie,Francisco Guerrero,Donato Castañeda,1h 27min,No especificado,
tt13593042,Gekijouban Shoujo Kageki Revue Starlight,Movie,Tomohiro Furukawa,Tatsuto Higuchi,2h,7.8,"Starlight - This is a story of a far off star, a long time ago, and in the distant future. Two young girls, captivated by the glamour of the performance, exchange promises: ""We'll become stars."" ""I'll wait for you on stage."""
tt0233142,3000 Miles to Graceland,Movie,Demian Lichtenstein,Richard Recco Demian Lichtenstein Kevin Bernhardt,2h 5min,6.0,Una banda de expresidiarios atraca un casino durante la semana de la convención de fans de Elvis.
tt3838992,Yoga Hosers,Movie,Kevin Smith,Kevin Smith,1h 28min,4.2,Dos adolescentes entusiastas del yoga deben luchar contra una presencia malévola que amenaza con destruir sus planes de fiesta loca.
tt16364330,"Romeo, Giulietta e Omicidi",Movie,Matteo Pagliarusco,Matteo Pagliarusco,2h 18min,No especificado,No especificado
tt0375791,Gundaraj,Movie,Guddu Dhanoa,Anees Bazmee Robin Henry,2h 20min,4.3,Ajay Chauvan lives with his parents and a younger sister. Ajay loves Pooja and hopes to get marry to her one day; he prepares a job application and send it to various places but in the mean-while he stages dance programs and performs in street fights to meet his family needs. A few days later he receive a letter informing him that he must present himself for an interv... Leer todo
tt7941444,Papers X,Movie,Tony Tale,Tony Tale,1h 8min,7.4,"Kayden McCoy, a troubled 15 year old High school Student is caught off Guard with the truth of her Family's Past and her secret power. Steaming from a Mysterious Fire at a Paper Factory in 1938 owned by her family. Claiming the life of her Great Great Grandfather and everyone inside."
tt0120224,Strategic Command,Movie,Rick Jacobson,Sean Mc Ginly Tripp Reed,1h 30min,4.2,"Rick Harding, exoficial de la Infantería de Marina, ahora trabaja en el FBI diseñando armas químicas. Mientras empaca para pasar la noche, soldados armados y liderados por el criminal prófugo, Carlos Gruber, asaltan el laboratorio."
tt9541602,Geukhanjikeob,Movie,Lee Byeong-heon,Se-yeong Bae,1h 51min,7.0,Una operación encubierta de la policía da un giro inesperado.
tt4439102,Officer Downe,Movie,Shawn Crahan,Joe Casey Chris Burnham,1h 28min,4.2,"Based on the graphic novel, a police officer who can't be stopped by death returns to the streets time and time again to fight crime."
tt8853502,Falsafa,Movie,Himanshu Yadav,Himanshu Yadav,2h 15min,8.9,"Aman's parents have been murdered and he is on a quest to seek revenge. On the other hand, Isha's father is dead and she's convinced that it's a murder, and is searching for the murderer. Their quest intertwines their lives with each other."
tt1118519,The Lost Samaritan,Movie,Thomas Jahn,Chris Artiga-Oliver Thomas Jahn,1h 35min,4.2,"After a long night at the office, an accountant stops to help an injured motorist and ends up becoming the target of two dangerous assassins."
tt11960074,Charlie,Movie,Shiva,Shiva,No especificado,4.4,
tt10751652,Private Number,Movie,Anand Kumar,Aryan Saha,1h 47min,No especificado,
tt3730490,The General Racing,Movie,Brendon Culliton,Brendon Culliton Paul Culliton,1h 20min,No especificado,No especificado
tt3187378,The Asian Connection,Movie,Daniel Zirilli,D. Glase Lomond Tom Sizemore Daniel Zirilli,1h 30min,3.2,"Dos expatriados estadounidenses, Jack y Sam, roban sin saberlo el dinero de un narcotraficante al robar una serie de bancos en el sudeste asiático, convirtiéndose en el objetivo de la venganza de la banda."
tt0378516,Pamilya Valderama,Movie,Augusto Salvador,Humilde 'Meek' Roxas,No especificado,4.8,
tt25305402,Sakunthalavin Kadhalan,Movie,P.V.Prasath,P.V.Prasath,No especificado,No especificado,No especificado
tt2626664,Babyshower,Movie,Philip Robinson,Philip Robinson Philip Robinson,1h 26min,5.6,No especificado
tt0906745,Good Luck with That,Movie,Igor Breakenback,Igor Breakenback,1h 34min,3.2,"Breakenbacks wife is kidnapped at the airport. Kidnappers request he collects a few items to trade for his wife. Breakenback is out of luck, the items are in the hands of cool assassins, crazy stuntman, wild dancers... and a chiropractor! For some reason there is a bunch of Ninjas on his back too... Well, good luck with that!"
tt25402886,Xzee vs OTTWitt,Movie,Nathan Breackenridge,De Witt Ford Nathan Breackenridge,No especificado,No especificado,In this Xzee and OTTWitt Is in an all out war it doesn't matter brothers or not this is a match of a life time but nothing can stop them from doing this well we can only hope that everything goes to plan but who's knows God might have a different plan.
tt5082112,Silang matatapang walang atras sa laban,Movie,Robert Talby,Jerry O. Tirazona,No especificado,No especificado,No especificado
tt0172610,Jie tou sha shou,Movie,Lu-Chiang Chao Lan Jing,Man Choi Lee Daoyuan Qian,1h 32min,4.6,Donnie Yen fights a deadly assassin named Tiger Yu and teaming a band of insurrectionists battling a malevolent gang of weapons smugglers.
tt1980986,Housefull 2,Movie,Sajid Khan,Tushar Hiranandani Sajid Khan Sajid Nadiadwala,2h 25min,5.3,A comedy of errors wherein four men help each other to fool their prospective father-in-laws creating a cascade of confusion and mayhem.
tt4685626,6:15,Movie,Ben Samuels,Ben Samuels,1h 23min,3.8,"An emotionally damaged couple try to survive a viral outbreak on an isolated farm in this innovative, immersive one-shot, real-time POV zombie thriller."
tt27831253,Badmashi Da Khyal Kawa,Movie,Arshad Khan,Jiya Butt Sheela Chaudhary Jahangir Khan Jani,No especificado,No especificado,No especificado
tt0118883,Conspiracy Theory,Movie,Richard Donner,Brian Helgeland,2h 15min,6.7,"Un taxista aficionado a las teorías de la conspiración se convierte en objetivo al resultar cierta una de estas teorías. Desafortunadamente, para salvarse a sí mismo, tiene que averiguar qué teoría es."
tt0436255,Durugin ng bala si Peter Torres,Movie,Toto Natividad,Tony Pascua,No especificado,No especificado,No especificado
tt0169858,"Shin seiki Evangelion Gekijô-ban: Air/Magokoro wo, kimi ni",Movie,Hideaki Anno Kazuya Tsurumaki,Hideaki Anno,1h 27min,8.1,Final cinematográfico de la serie de televisión de los 90 Neon Genesis Evangelion.
tt4641882,Todd McFarlane's Spawn 3: The Ultimate Battle,Movie,Keith David Richard Dysart Dominique Jennings,No especificado,2h 20min,8.2,"As Spawn struggles to control his own destiny, he is caught between the forces of Heaven and Hell. Heaven has sent merciless angels to destroy him, while Hell has its own forces beckoning him to serve his rightful master."
tt0364722,The Ultimate Game,Movie,Jack Kaprielian,Jack Kaprielian Margaret Margossian Kayvon Derak Shanian,1h 32min,5.2,"""SATO"" a sinister Asian warlord puts up $1 million dollar prize and attracts martial arts fighters to his remote island. He entraps them as they fight to the death."
tt28145172,Maaraket Al Naqeeb Nadia,Movie,Nadia Hamza,Ahmed Samir,No especificado,No especificado,
tt12013106,Trinity Blood: Genesis,Movie,Tomohiro Hirata,Sunao Yoshida Yûji Hosono Atsuhiro Tomioka,1h 30min,No especificado,90-minute US theatrical release to promote the TV series Basilisk (2005). The film was made by combining the first four episodes of the series.
tt27350099,Look Back,Movie,Ranjan Mullaratt,Ranjan Mullaratt,No especificado,No especificado,"Defiant and determined to create a unique lifestyle of equality and independence for herself, Siddha neglects and defies her parents' desire to marry her off to a man she doesn't love. She plans eloping with her lover, Krishna. Instead of loving her in return, Krishna treats her badly by cheating on her. Broken and depressed, Siddha runs away to an isolated road with ... Leer todo"
tt7368004,Rock'n'Roll Eddie,Movie,Tomasz Szafranski,Tomasz Szafranski,1h 41min,4.2,Dos niños conocen a un fugitivo muy rocanrol de otro mundo que es perseguido por cazarrecompensas. Para salvar su vida tendrán que encontrar la forma de enviarlo de vuelta a donde pertenece.
tt1846589,Hunter Killer,Movie,Donovan Marsh,Arne Schmidt Jamie Moss George Wallace,2h 1min,6.6,"Un capitán de submarino estadounidense sin experiencia forma equipo con los Navy Seals de Estados Unidos para rescatar al presidente ruso, que ha sido secuestrado por un general renegado."
tt15837542,The Jethroverse: Hollow Victory,Movie,Rowan Wood,Rowan Wood,No especificado,No especificado,"Worlds collide in HOLLOW VICTORY, the explosive finale to the story of THE JETHROVERSE. Not only has Jethro Smith returned, but a new multiversal threat has emerged...and it falls to Vincent, Trevor, Raven and more to fight it."
tt2957680,Tao chu sheng tian,Movie,Danny Pang Oxide Chun Pang,Danny Pang Oxide Chun Pang Kam-Yuen Szeto,1h 47min,5.7,"On the hottest day in 50 years, a serious fire incident happened to a busy commercial tower, a gaggle of fire fighters with an indestructible enthusiasm are going to save lives."
tt6210456,Let's Be Frank,Movie,Peter Hamblin,Peter Hamblin,50min,7.5,"Let's Be Frank is a visceral journey through the unseen and unknown world of big wave surf adventurer Frank James Solomon, an intercontinental clandestine investigation blurring the lines between myth, legend and reality."
tt0476582,Pink_D,Movie,Kazuhiro Kunishi Gou Suzuki,Kazuhiro Kunishi Gou Suzuki,1h 31min,No especificado,No especificado
tt7892050,Chekka Chivantha Vaanam,Movie,Mani Ratnam,Siva Ananth Mani Ratnam,2h 26min,7.2,A bloody power struggle erupts between three brothers who are vying to take over the family business following the death of their father.
tt1734582,Dawn of the Dragonslayer,Movie,Anne K. Black,Anne K. Black Kynan Griffin Justin Partridge,1h 37min,4.3,"After Will's father is killed by a dragon, he embarks on an epic journey to seek vengeance against the vicious monster."
tt8404472,Origins V: Times Arrow,Movie,Kyle Parish,Kyle Parish,2h 2min,No especificado,"A Star Wars Fan Film. Following the events of Origins IV: Revelations, the Dark Lord Jack moves to find a new apprentice while he dominates the peaceful world of Tython. Once he has his newest member to his evil team, Jack will begin a quest for a powerful artifact, the Crucible, which has the power to finally give Jack the life he always wanted. The Life he was owed.... Leer todo"
tt6416304,Spider-Man: Balance Act,Movie,Cameron Dodd Mark Ricci,Cameron Dodd Mark Ricci,54min,6.5,"For Peter Parker, (Mark Ricci) life is hard. Balancing school, work, friendships, and of course, Spider-Man, is no easy feat. But it won't get any easier as a new villain emerges - The Kingpin."
tt28702667,Sacred Thieves,Movie,Mario Emmanuel,Mario Emmanuel Emeh Joshua,1h 15min,No especificado,No especificado
tt4940452,Bank,Movie,Jah,Jah,1h 38min,6.0,Two street rivals must set their difference aside and join forces to pull off a bank heist.
tt2323717,X - The Last Moment,Movie,Bambi Martantio,Bambi Martantio Bani Ramadhan,1h 24min,No especificado,No especificado
tt0111185,Bullet Down Under,Movie,Rob Stewart,Karl Schiffman Neal Z. Gechtman,1h 35min,4.7,"Signal One is a fast paced thriller that will have you guess till the very end. A tormented former cop is disenchanted with LA madness and moves to Australia to start afresh. He's drawn into a world of drugs, murder, money and deceit. One wrong move, one slip up and he'll become and he will become another notch on the underworld's gun."
tt10417584,Once a Soja: Agubiri the Gateman,Movie,Nabwana I.G.G.,Nabwana I.G.G.,1h 4min,No especificado,
tt13314738,Das Spiel Endet,Movie,Meto Ege,Meto Ege,1h 40min,5.2,"When the head of a large corporation is murdered, the situation comes to a head. Markes is appointed his successor and Acun, his partner, supports him. The two real estate agents have to reckon with the police watching their every move."
tt0390391,Province 77,Movie,Smith Timsawat,Charlene Amatavanich Van Ayasit Prinya Intachai,1h 51min,5.5,"Thai Town is a six-block area near Hollywood, Los Angeles, which is home to over 50,000 expatriated Thais. The town is such a gateway for Thais entering America it was dubbed Thailand's 77th Province. The movie follows a Thai family as it struggles to survive in Los Angeles' fast-paced consumerist culture, while still maintaining traditional values. The identity strug... Leer todo"
tt1552010,Veer Yodha Prithviraj Chauhan,Movie,Rakesh Prasad,Rakesh Prasad,1h 25min,8.0,The story of the great king who ruled a kingdom in northern India during the latter half of the 12th century.
tt7036540,The Savant,Movie,Sherri Kauk,Ken Del Vecchio,1h 25min,4.0,Solo 25 sabios autistas en el mundo y su habilidad es la lucha.
tt5956100,Tiger Zinda Hai,Movie,Ali Abbas Zafar,Neelesh Misra Ali Abbas Zafar Aditya Chopra,2h 41min,5.9,"Inspired by real events, Tiger Zinda Hai is a sequel to the blockbuster Ek Tha Tiger, and an espionage action drama that follows a daring rescue mission in Iraq."
